no;kdprov;kdkab;nama_perusahaan;alamat;kdprovkab;lblkab;kawasan_fasih;nama_kawasan;kawasan
4251;35;15;PT MAKMUR BERKAH AMANDA TBK;JL. VETERAN KM. 5,5 (LINGKAR TIMUR) SAFE N LOCK ECO INDUSTRIAL PARK KAV. E SIDOARJO, 61234, JAWA TIMUR;3515;[15] SIDOARJO;Kawasan Industri;Kawasan Industri Safe N Lock;Kawasan Industri
4252;35;15;CV. HOKKY BERLIMPAH-LIMPAH;AI 5906;3515;[15] SIDOARJO;Kawasan Industri;Kawasan Industri Safe N Lock;Kawasan Industri
4253;35;15;PT. KAWASAN INDUSTRI SIDOARJO (#227);DESA TAMBAK KALIJODO, KEC. JABON;3515;[15] SIDOARJO;Kawasan Industri;Kawasan Industri Sidoarjo;Kawasan Industri
4254;35;15;PT. MITRA MORTAR INDONESIA;V 1975-1976;3515;[15] SIDOARJO;Kawasan Industri;Kawasan Industri Safe N Lock;Kawasan Industri
4255;35;15;PT. INDO MALABAR SAFE TRADING;SAFE AND LOCK INDUSTRIAL ESTATE, PUCANGONAM, JLN BLOK AD 5303 - 5305, LINGKAR TIMUR, SIDOARJO, SIDOARJO REGENCY, EAST JAVA;3515;[15] SIDOARJO;Kawasan Industri;Kawasan Industri Safe N Lock;Kawasan Industri
4256;35;15;GRAHA ANUGRAH SAMPOERNA;SIRIE;3515;[15] SIDOARJO;Kawasan Industri;Kawasan Industri SiRIE;Kawasan Industri
4257;35;15;PT. MULTI COLOUR INDONESIA;V2 3315;3515;[15] SIDOARJO;Kawasan Industri;Kawasan Industri Safe N Lock;Kawasan Industri
4258;35;15;SUGGIH MAST PLASTIK;KAWASAN INDUSTRI SAFE LOCK BLOK AA - 5226;3515;[15] SIDOARJO;Kawasan Industri;Kawasan Industri Safe N Lock;Kawasan Industri
4259;35;15;OSCARMAS;KOMPLEK PERGUDANGAN CENTRAL INDUSTRIAL PARK BLOK F NO. 10, KEL/DESA KEMIRI, KEC. SIDOARJO., DESA/KELURAHAN KEMIRI, KEC. SIDOARJO, KAB. SIDOARJO, PROVINSI JAWA TIMUR;3515;[15] SIDOARJO;Kawasan Industri;Central Industrial Park;Kawasan Industri
4260;35;15;PT LOTUS SPEKTRUM JAYA ABADI;JALAN LINGKAR TIMUR RT.005 RW.002, KEMIRI, SIDOARJO, JAWA TIMUR;3515;[15] SIDOARJO;Kawasan Industri;Kawasan Industri SiRIE;Kawasan Industri
4261;35;15;PT. GARUDA MAS CITRA CEMERLANG;K 1723;3515;[15] SIDOARJO;Kawasan Industri;Kawasan Industri Safe N Lock;Kawasan Industri
4262;35;15;PT. TRIASINDOMIX;B 1299;3515;[15] SIDOARJO;Kawasan Industri;Kawasan Industri Safe N Lock;Kawasan Industri
4263;35;15;PT. BINTANG ADYA PASTIKA GLASS ABADI;J 1605;3515;[15] SIDOARJO;Kawasan Industri;Kawasan Industri Safe N Lock;Kawasan Industri
4264;35;15;DEVA MEDIKA INDONESIA;KOMPLEK PERINDUSTRIAN DAN PERGUDANGAN SAFE AND LOCK UNIT B 2338.. LINGKAR TIMUR KM 5.5;3515;[15] SIDOARJO;Kawasan Industri;Kawasan Industri Safe N Lock;Kawasan Industri
4265;35;15;PT. PANGAN NUTRISI SEJAHTERA;JL. LINGKAR TIMUR KM. 04, CENTRAL INDUSTRIAL PARK BLOK SIGMA NO. 14;3515;[15] SIDOARJO;Kawasan Industri;Central Industrial Park;Kawasan Industri
4266;35;15;PT. PRIMA UTAMA JATIM;"G 1573; G 1575";3515;[15] SIDOARJO;Kawasan Industri;Kawasan Industri Safe N Lock;Kawasan Industri
4267;35;15;CV. SURYA INTI GAS;PERGUDANGAN SAFE N LOCK;3515;[15] SIDOARJO;Kawasan Industri;Kawasan Industri Safe N Lock;Kawasan Industri
4268;35;15;PT. NEW ASIA INTERNASIONAL (NAI);KAWASAN INDUSTRI SIDOARJO;3515;[15] SIDOARJO;Kawasan Industri;Kawasan Industri Safe N Lock;Kawasan Industri
4269;35;15;YAHATA MANUFACTURING INDONESIA;KAWASAN INDUSTRI DAN PERGUDANGAN SAFE N LOCK, JL. LINGKAR TIMUR 5.5;3515;[15] SIDOARJO;Kawasan Industri;Kawasan Industri Safe N Lock;Kawasan Industri
4270;35;15;PT. ZAHONERO INDONESIA;PERGUDANGAN SAFE N LOCK U 1956-1957;3515;[15] SIDOARJO;Kawasan Industri;Kawasan Industri Safe N Lock;Kawasan Industri
4271;35;15;PT. ANEKA KONSUMSI SELERA INTERNASIONAL;G 1570;3515;[15] SIDOARJO;Kawasan Industri;Kawasan Industri Safe N Lock;Kawasan Industri
4272;35;15;PT. TORANI BERKAH MANDIRI;"B 2309; C 2367";3515;[15] SIDOARJO;Kawasan Industri;Kawasan Industri Safe N Lock;Kawasan Industri
4273;35;15;PT. PRUNUS INTERNATIONAL;E 1530;3515;[15] SIDOARJO;Kawasan Industri;Kawasan Industri Safe N Lock;Kawasan Industri
4274;35;15;PT. DAUN MAS NUSANTARA;AG 5701;3515;[15] SIDOARJO;Kawasan Industri;Kawasan Industri Safe N Lock;Kawasan Industri
4275;35;15;BEST COLOUR INDONESIA, PT;JL. KOMPLEK PERGUDANGAN SAFE AND LOCK F/1552-1553;3515;[15] SIDOARJO;Kawasan Industri;Kawasan Industri Safe N Lock;Kawasan Industri
4276;35;15;ZAIN MULTI ANUGERAH. PT;KAWASAN INDUSTRI DAN PERGUDANGAN SAFE N LOCK BLOK O NO. 1738;3515;[15] SIDOARJO;Kawasan Industri;Kawasan Industri Safe N Lock;Kawasan Industri
4277;35;15;PT. CIPTA SURYA PLASTINDO;AI 5911;3515;[15] SIDOARJO;Kawasan Industri;Kawasan Industri Safe N Lock;Kawasan Industri
4278;35;15;CV. TRI ORI PLASTINDO;KOMPLEKS INDUSTRI DAN PERGUDANGAN SAFE N LOCK BLOK AJ-5976;3515;[15] SIDOARJO;Kawasan Industri;Kawasan Industri Safe N Lock;Kawasan Industri
4279;35;15;PT RADIAN SUKSES BERSAMA;PERGUDANGAN CENTRAL INDUSTRI PARK, BLOK OMEGA NO.21, AREA SAWAH, KEMIRI, KEC. SIDOARJO, KABUPATEN SIDOARJO;3515;[15] SIDOARJO;Kawasan Industri;Central Industrial Park;Kawasan Industri
4280;35;15;PT SYMMEX MEDICAL INDONESIA;KAWASAN INDUSTRI SIRIE;3515;[15] SIDOARJO;Kawasan Industri;Kawasan Industri SiRIE;Kawasan Industri
4281;35;15;SAMATOR INDO GAS,PT;JL. BERBEK INDUSTRI I NO. 23A. KAWASAN INDUSTRI SIER;3515;[15] SIDOARJO;Kawasan Industri;Surabaya Industrial Estate Rungkut (SIER);Kawasan Industri
4282;35;15;PT. ANTARIKSA NUSANTARA INDONESIA GROUP;PERGUDANGAN SAFE N LOCK BLOCK AR 6725;3515;[15] SIDOARJO;Kawasan Industri;Kawasan Industri Safe N Lock;Kawasan Industri
4283;35;15;PT YOGYA KRISTAL SEJATI;KOMPLEK PERGUDANGANG CENTRAL INDUSTRIAL PARK (CIP) KAVELING E NOMOR 16, DESA/KELURAHAN KEMIRI, KEC.SIDOARJO, KAB.SIDOARJO, PROV JAWA TIMUR;3515;[15] SIDOARJO;Kawasan Industri;Central Industrial Park;Kawasan Industri
4284;35;15;PRECISION WAVE INDONESIA;KAWASAN INDUSTRI DAN PERGUDANGAN SAFE N LOCK BLOK AD NO. 5312, JL. VETERAN KM. 5,5 LINGKAR TIMUR;3515;[15] SIDOARJO;Kawasan Industri;Kawasan Industri Safe N Lock;Kawasan Industri
4285;35;15;CIPTA SURYA MANUNGGAL UTAMA / PT CIPTA SURYA PLASTINDO;A 1269;3515;[15] SIDOARJO;Kawasan Industri;Kawasan Industri Safe N Lock;Kawasan Industri
4286;35;15;CV FID PACK;PERGUDANGAN CENTRAL INDUSTRIAL PARK BLOK A NOMOR 1;3515;[15] SIDOARJO;Kawasan Industri;Central Industrial Park;Kawasan Industri
4287;35;15;CV. BERSAMA SEJAHTERA PLASTIK;SAFENLOCK BLOK J 1653 , KEL. RANGKAHKIDUL, KEC. SIDOARJO, KAB. SIDOARJO, PROV. JAWA TIMUR;3515;[15] SIDOARJO;Kawasan Industri;Kawasan Industri Safe N Lock;Kawasan Industri
4288;35;15;CV. RAMAKA;DELTA 20;3515;[15] SIDOARJO;Kawasan Industri;Central Industrial Park;Kawasan Industri
4289;35;15;MESTIKA NUSANTARA AGROKIMIA;JL. LINGKAR TIMUR KM 4,KOMOLEK PERGUDANGAN CIP KAVLING F-23, KAB. SIDOARJO;3515;[15] SIDOARJO;Kawasan Industri;Central Industrial Park;Kawasan Industri
4290;35;15;PT EMPAT PILAR SEJAHTERA;PERGUDANGAN CENTRAL INDUSTRIAL PARK SIGMA;3515;[15] SIDOARJO;Kawasan Industri;Central Industrial Park;Kawasan Industri
4291;35;15;PT GALAXY LINK INDONESIA;AP 6519;3515;[15] SIDOARJO;Kawasan Industri;Kawasan Industri Safe N Lock;Kawasan Industri
4292;35;15;PT MASTER PRINT, TBK;LINGKAR TIMUR KM 4 KAWASAN INDUSTRI & PERGUDANGAN CIP, OMEGA 22-23, SIDOARJO;3515;[15] SIDOARJO;Kawasan Industri;Central Industrial Park;Kawasan Industri
4293;35;15;PT SKY MORTAR INDONESIA;JL ASEM III NO. 18, ASEMROWO;3515;[15] SIDOARJO;Kawasan Industri;Central Industrial Park;Kawasan Industri
4294;35;15;PT SUNTA SURYA MAKMUR;CENTRAL INDUSTRIAL PARK JL LINGKAR TIMUR KM 4 ZETA 15-16 KEMIRI SIDOARJO;3515;[15] SIDOARJO;Kawasan Industri;Central Industrial Park;Kawasan Industri
4295;35;15;PT. ACCELLERON SAKTI INDONESIA;KOMPLEK PERGUDANGAN WIDYA SAKTI, JL RAYA BEKASI KM28, E26 RT04/RW02 MEDAN SATRIA KOTA BEKASI 17132;3515;[15] SIDOARJO;Kawasan Industri;Kawasan Industri Safe N Lock;Kawasan Industri
4296;35;15;PT. CAHAYA SAKTI KIMIA;KOMPLEKS PERGUDANGAN SIRIE BLOK Q-57, JL. RAYA LINGKAR TIMUR KM 5, RANGKAH KIDUL, KEC. SIDOARJO, KAB. SIDOARJO, JAWA TIMUR;3515;[15] SIDOARJO;Kawasan Industri;Kawasan Industri SiRIE;Kawasan Industri
4297;35;15;PT. ESTEE INTERNASIONAL KOSMETIKA;PERGUDANGAN CENTRAL INDUSTRIAL PARK BLOK DELTA NOMOR 6 JALAN LINGKAR TIMUR KM 4, DESA/KELURAHAN KEMIRI, KEC. SIDOARJO, KAB. SIDOARJO, PROVINSI JAWA TIMUR,;3515;[15] SIDOARJO;Kawasan Industri;Central Industrial Park;Kawasan Industri
4298;35;15;PT. FULLXIN INDONESIA;JL LINGKAR TIMUR KM 5.5 KAWASAN INDUSTRI DAN PERG SAFE N LOCK BLOK AG 5715 - 5718 SIDOARJO;3515;[15] SIDOARJO;Kawasan Industri;Kawasan Industri Safe N Lock;Kawasan Industri
4299;35;15;PT. LABAN RAYA SAMUDRA;J 1607;3515;[15] SIDOARJO;Kawasan Industri;Kawasan Industri Safe N Lock;Kawasan Industri
4300;35;15;PT. LAUT INDO PERKASA;SAFE N LOCK BLOK AD NO 5631;3515;[15] SIDOARJO;Kawasan Industri;Kawasan Industri Safe N Lock;Kawasan Industri
4301;35;15;PT. MAKMUR BERSAMA PLASINDO;JL. LINGKAR TIMUR KOMPLEK PERGUDANGAN CIP BLOK ZETA-09;3515;[15] SIDOARJO;Kawasan Industri;Central Industrial Park;Kawasan Industri
4302;35;15;PT. POMPA YORK INDONESIA;JALAN R.E MARTADINATA 56 BLOK D NOMOR 5;3515;[15] SIDOARJO;Kawasan Industri;Central Industrial Park;Kawasan Industri
4303;35;15;PT. TIRTA ASFIE GEMILANG;JL. LINGKAR TIMUR KM 4 PERGUDANGAN CIP BLOK ZETA NO.29 KEMIRI SIDOARJO;3515;[15] SIDOARJO;Kawasan Industri;Central Industrial Park;Kawasan Industri
4304;35;15;PT. TOYO INK INDONESIA/PT MBA;AJ 5958;3515;[15] SIDOARJO;Kawasan Industri;Kawasan Industri Safe N Lock;Kawasan Industri
4305;35;15;PT. TRI HASTA PERKASA;PERGUDANGAN CIP BLOK ALPHA NO. 18 JL. VETERAN, DESA KEMIRI, KECAMATAN SIDOARJO 61219;3515;[15] SIDOARJO;Kawasan Industri;Central Industrial Park;Kawasan Industri
4306;35;15;PT. VALENCE BONDING TECHNOLOGY INDONESIA;LINGKAR TIMUR KM 5,5 PERGUDANGAN SAFE N LOCK BLOCK AJ NO.5931 PUCANGANOM, SIDOARJO;3515;[15] SIDOARJO;Kawasan Industri;Kawasan Industri Safe N Lock;Kawasan Industri
4307;35;15;VASA PUTRA MANDIRI;SIRIE;3515;[15] SIDOARJO;Kawasan Industri;Kawasan Industri SiRIE;Kawasan Industri
4308;35;15;DYNAMIC BOILER NUSANTARA;KAWASAN INDUSTRI DAN PERGUDANGAN SIDOARJO RANGKAH INDUSTRI ESTATE BLOK D NO 15 JL.LINGKAR TIMUR KM 5,5;3515;[15] SIDOARJO;Kawasan Industri;Kawasan Industri SiRIE;Kawasan Industri
4309;35;15;CEMERLANG INDAH BERSAMA;CENTRAL INDUSTRIAL PARK JL. LINGKAR TIMUR KM.4 AREA SAWAH;3515;[15] SIDOARJO;Kawasan Industri;Central Industrial Park;Kawasan Industri
4310;35;15;ALAM HIJAU MUSTIKA;KAWASAN INDUSTRI DAN PERGUDANGAN SIRIE JL RAYA LINGKAR TIMUR KM 5.5 BLOK H NO 12;3515;[15] SIDOARJO;Kawasan Industri;Kawasan Industri SiRIE;Kawasan Industri
4311;35;15;SOFTEX INDONESIA, PT;SAFE N LOCK B2 RANGKAHKIDUL KECAMATAN SIDOARJO;3515;[15] SIDOARJO;Kawasan Industri;Kawasan Industri Safe N Lock;Kawasan Industri
4312;35;15;CIPTA NUSA,. CV;SAFE N LOCK BLOK J 1657;3515;[15] SIDOARJO;Kawasan Industri;Kawasan Industri Safe N Lock;Kawasan Industri
4313;35;15;PT. AKU SAYANG INDONESIA;BLOK V1 3257 - 3258;3515;[15] SIDOARJO;Kawasan Industri;Kawasan Industri Safe N Lock;Kawasan Industri
4314;35;15;PT. SUMBER JAYA JISHIDUO;BLOK V1 NO 3201;3515;[15] SIDOARJO;Kawasan Industri;Kawasan Industri Safe N Lock;Kawasan Industri
4315;35;15;CV. KORINDO MAKMUR;PERGUDANGAN SAFE N LOCK BLOK S NOMOR 1875;3515;[15] SIDOARJO;Kawasan Industri;Kawasan Industri Safe N Lock;Kawasan Industri
4316;35;15;CV. DELTA MINA JAYA;F 1532;3515;[15] SIDOARJO;Kawasan Industri;Kawasan Industri Safe N Lock;Kawasan Industri
4317;35;15;MANDALA CAHAYA SENTOSA , PT;JL. RAYA LINGKAR TIMUR KM 5,5 PERGUDANGANINDUSTRI SAFENLOCK;3515;[15] SIDOARJO;Kawasan Industri;Kawasan Industri Safe N Lock;Kawasan Industri
4318;35;15;PT. UTAMA GAS MULTIPERKASA;"V5 3601; O 1739";3515;[15] SIDOARJO;Kawasan Industri;Kawasan Industri Safe N Lock;Kawasan Industri
4319;35;15;FRONTEC AGRITAMA ENGINERING, CV;JL LINGKAR TIMUR KOMPLEK PERGUDANGAN SAFE N LOCK BLOK C 2376;3515;[15] SIDOARJO;Kawasan Industri;Kawasan Industri Safe N Lock;Kawasan Industri
4320;35;15;PT. AMIN JAYA GEMILANG;PERGUDANGAN SAFE N LOCCK BLOK T1921-1922;3515;[15] SIDOARJO;Kawasan Industri;Kawasan Industri Safe N Lock;Kawasan Industri
4321;35;15;PT. ARIA DASAKA PUTRATAMA;CIP;3515;[15] SIDOARJO;Kawasan Industri;Central Industrial Park;Kawasan Industri
4322;35;16;PT SINOSURAFAT CHEMISTRY INDOENSIA;NGORO INDUSTRI PERSADA BLOK E 20-22;3516;[16] MOJOKERTO;Kawasan Industri;Ngoro Industrial Park;Kawasan Industri
4323;35;16;TEMPO LAND;KAWASAN INDUSTRI NGORO INDUSTRIAL PARK BLOK D3-A KEL. LOLAWANG KEC. NGORO;;;;;Kawasan Industri
4324;35;16;PT WAJAR LOGAM JAYA;KAWASAN BERIKAT NIP BLOK E NO.01;3516;[16] MOJOKERTO;Kawasan Industri;Ngoro Industrial Park;Kawasan Industri
4325;35;16;PT TOYOTA-ASTRA MOTOR;NIP;3516;[16] MOJOKERTO;Kawasan Industri;Ngoro Industrial Park;Kawasan Industri
4326;35;16;PT NGORO HUI DING PLASTIC;NGORO INDUSTRI PERSADA S2, LOLAWANG, NGORO, MOJOKERTO;3516;[16] MOJOKERTO;Kawasan Industri;Ngoro Industrial Park;Kawasan Industri
4327;35;16;PT. INTILAND SEJAHTERA (#7);JALAN RAYA NGORO;3516;[16] MOJOKERTO;Kawasan Industri;Ngoro Industrial Park;Kawasan Industri
4328;35;16;PT TEMPO UTAMA SEJAHTERA;NIP;;;;;Kawasan Industri
4329;35;16;PT BAMBANG DJAJA;NGORO INDUSTRI PERSADA BLOCK C1-2, NGORO;3516;[16] MOJOKERTO;Kawasan Industri;Ngoro Industrial Park;Kawasan Industri
4330;35;16;PT ROMAN CERAMIC INTERNATIONAL;NGORO INDUSTRI PERSADA BLOK P-3;3516;[16] MOJOKERTO;Kawasan Industri;Ngoro Industrial Park;Kawasan Industri
4331;35;16;PT. KAWASAN INDUSTRI INTILAND (#190);JALAN RAYA NGORO, NGORO, MOJOKERTO;3516;[16] MOJOKERTO;Kawasan Industri;Ngoro Industrial Park;Kawasan Industri
4332;35;16;PT DIG GRAPHICS;NIP;;;;;Kawasan Industri
4333;35;16;PT ALAM LESTARI UNGGUL;NIP;3516;[16] MOJOKERTO;Kawasan Industri;Ngoro Industrial Park;Kawasan Industri
4334;35;16;PT UNI-CHARM INDONESIA;NIP LOT D2-1, DESA LOLAWANG, NGORO;3516;[16] MOJOKERTO;Kawasan Industri;Ngoro Industrial Park;Kawasan Industri
4335;35;16;PT TOMATEC INDONESIA;KAWASAN NIP B2-3A;3516;[16] MOJOKERTO;Kawasan Industri;Ngoro Industrial Park;Kawasan Industri
4336;35;16;PT SECOND BEST PACKAGING;NIP BLOK G 1-1A, F 11, 12, 18;3516;[16] MOJOKERTO;Kawasan Industri;Ngoro Industrial Park;Kawasan Industri
4337;35;16;PT SWANSON PLASTICS INDONESIA;NGORO INDUSTRI PERSADA BLOK D2-3;3516;[16] MOJOKERTO;Kawasan Industri;Ngoro Industrial Park;Kawasan Industri
4338;35;16;JAVA TAIKO DRUMS INDUSTRIES, PT;KAWASAN NGORO INDUSTRI PERSADA KAV. V-8 DESA LOLAWANG, NGORO;3516;[16] MOJOKERTO;Kawasan Industri;Ngoro Industrial Park;Kawasan Industri
4339;35;16;PT TANDI SURYA MAS;NGORO INDUSTRI PERSADA;3516;[16] MOJOKERTO;Kawasan Industri;Ngoro Industrial Park;Kawasan Industri
4340;35;16;PT DUNIA WARNA MEGAH;KAWASAN INDUSTRI NGORO KAV.I/1 KEC.NGORO;3516;[16] MOJOKERTO;Kawasan Industri;Ngoro Industrial Park;Kawasan Industri
4341;35;16;PT SURYA MILENIA;NGORO INDUSTRI PERSADA;;;;;Kawasan Industri
4342;35;16;PT MITRA SEMESTA LEMINDO;KAWASAN INDUSTRI NIP BLOK N-5;3516;[16] MOJOKERTO;Kawasan Industri;Ngoro Industrial Park;Kawasan Industri
4343;35;16;PT SKY INDONESIA;NGORO INDUSTRI PERSADA BLOK U1 NGORO MOJOKERTO;3516;[16] MOJOKERTO;Kawasan Industri;Ngoro Industrial Park;Kawasan Industri
4344;35;16;PT HOME FAUCETS INDONESIA;NIP BLOK I/18;3516;[16] MOJOKERTO;Kawasan Industri;Ngoro Industrial Park;Kawasan Industri
4345;35;16;PT MIRAE FLATWARE INDONESIA;NGORO INDUSTRI PERSADA BLOK H NO.18;3516;[16] MOJOKERTO;Kawasan Industri;Ngoro Industrial Park;Kawasan Industri
4346;35;16;AICE ICE CREAM JATIM INDUSTRY;KAWASAN INDUSTRI NGORO INDUSTRIAL PARK (NIP), KAV. D3B;3516;[16] MOJOKERTO;Kawasan Industri;Ngoro Industrial Park;Kawasan Industri
4347;35;16;PT HBFULLER ADHESIVES INDONESIA;NIP BLOK C02-03 DESA LOLAWANG;;;;;Kawasan Industri
4348;35;16;PT NIAGA SEJAHTERA PLASTIK;NGORO INDUSTRI PERSADA;3516;[16] MOJOKERTO;Kawasan Industri;Ngoro Industrial Park;Kawasan Industri
4349;35;16;PT HERTZ FLAVOR MAKMUR INDONESIA;NIP BLOK CC-3A;3516;[16] MOJOKERTO;Kawasan Industri;Ngoro Industrial Park;Kawasan Industri
4350;35;16;PT UNITED CAN;NGORO INDUSTRI PERSADA C2-1;3516;[16] MOJOKERTO;Kawasan Industri;Ngoro Industrial Park;Kawasan Industri
4351;35;16;PAMITRAMAS MULIA;NGORO INDUSTRI PERSADA (NIP) KAV. P-1 GEDUNG B;3516;[16] MOJOKERTO;Kawasan Industri;Ngoro Industrial Park;Kawasan Industri
4352;35;16;PT UNION METAL;NIP;;;;;Kawasan Industri
4353;35;16;PT GYUNG DO INDONESIA;NGORO INDUSTRI PERSADA;3516;[16] MOJOKERTO;Kawasan Industri;Ngoro Industrial Park;Kawasan Industri
4354;35;16;PT KINGSON METAL INDUSTRY INDONESIA;NIP BLOK M-5 NGORO MOJOKERTO;3516;[16] MOJOKERTO;Kawasan Industri;Ngoro Industrial Park;Kawasan Industri
4355;35;16;PT CORT INDONESIA;KAWASAN BERIKAT NIP BLOK G 5, 6, NGORO MOJOKERTO;3516;[16] MOJOKERTO;Kawasan Industri;Ngoro Industrial Park;Kawasan Industri
4356;35;16;PT HP METALS INDONESIA;NGORO INDUSTRI PERSADA BLOK K-2 BERIKAT;3516;[16] MOJOKERTO;Kawasan Industri;Ngoro Industrial Park;Kawasan Industri
4357;35;16;GTECH STEEL INTERNASIONAL;NGORO INDUSTRI PERSADA BLOK J-17 RT 002 RW 001;3516;[16] MOJOKERTO;Kawasan Industri;Ngoro Industrial Park;Kawasan Industri
4358;35;16;PT JINGSHENG INTERNATIONAL BIOTECHNOLOGY;NGORO INDUSTRI PERSADA KAVLING H15;3516;[16] MOJOKERTO;Kawasan Industri;Ngoro Industrial Park;Kawasan Industri
4359;35;16;PT HOPAX INDONESIA;NGORO INDUSTRI PERSADA;3516;[16] MOJOKERTO;Kawasan Industri;Ngoro Industrial Park;Kawasan Industri
4360;35;16;PT KUNYUN GRAVURE INDUSTRIES INDONESIA;NGORO INDUSTRIAL PARK BLOK I NO 1A;3516;[16] MOJOKERTO;Kawasan Industri;Ngoro Industrial Park;Kawasan Industri
4361;35;16;PT LOGISTEED INDONESIA;NIP LOT D2-2 LOLAWANG MOJOKERTO;3516;[16] MOJOKERTO;Kawasan Industri;Ngoro Industrial Park;Kawasan Industri
4362;35;16;PT OBON INDONESIA;NGORO INDUSTRI PERSADA BLOK H 16 17;3516;[16] MOJOKERTO;Kawasan Industri;Ngoro Industrial Park;Kawasan Industri
4363;35;16;PT ROSELLA;NIP BLOK S-6;3516;[16] MOJOKERTO;Kawasan Industri;Ngoro Industrial Park;Kawasan Industri
4364;35;16;RUMI METAL INDONESIA;NGORO INDUSTRI PERSADA BLOK J-17 RT 002 RW 001;3516;[16] MOJOKERTO;Kawasan Industri;Ngoro Industrial Park;Kawasan Industri
4365;35;16;PT INDO BATAM EKATAMA;NGORO INDUSTRI PERSADA;;;;;Kawasan Industri
4366;35;16;PT KOBIN KERAMIK INDONESIA;NGORO INDUSTRI PERSADA BLOK O NO. 5-7;3516;[16] MOJOKERTO;Kawasan Industri;Ngoro Industrial Park;Kawasan Industri
4367;35;16;PT HAKAMATA UTAMA;NGORO INDUSTRI PERSADA BLOK N-1 NGORO MOJOKERTO;;;;;Kawasan Industri
4368;35;16;PT YUAN TEAI INDONESIA;JL NGORO INDUSTRI PERSADA BLOK L-5, NGORO, KAB. MOJOKERTO, JAWA TIMUR;3516;[16] MOJOKERTO;Kawasan Industri;Ngoro Industrial Park;Kawasan Industri
4369;35;16;PT PINJAYA LOGAM;NIP M-3A;3516;[16] MOJOKERTO;Kawasan Industri;Ngoro Industrial Park;Kawasan Industri
4370;35;16;PT BETTS INDONESIA;NGORO INDUSTRI PERSADA L-1;3516;[16] MOJOKERTO;Kawasan Industri;Ngoro Industrial Park;Kawasan Industri
4371;35;16;PT S&S HYGIENE SOLUTION;KAWASAN NIP BLOK B NO.2-3 B;3516;[16] MOJOKERTO;Kawasan Industri;Ngoro Industrial Park;Kawasan Industri
4372;35;16;PT SUN POWER CERAMIC;NGORO INDUSTRI PERSADA;3516;[16] MOJOKERTO;Kawasan Industri;Ngoro Industrial Park;Kawasan Industri
4373;35;16;PT EASTHOPE AGRICULTURE;NIP BLOK U-2 KAWASAN BERIKAT;3516;[16] MOJOKERTO;Kawasan Industri;Ngoro Industrial Park;Kawasan Industri
4374;35;16;PT CHAROEN POKPHAND INDONESIA;NGORO INDUSTRI PERSADA;3516;[16] MOJOKERTO;Kawasan Industri;Ngoro Industrial Park;Kawasan Industri
4375;35;16;PT KARYA MURNI INDOCIPTA;NIP V-2;3516;[16] MOJOKERTO;Kawasan Industri;Ngoro Industrial Park;Kawasan Industri
4376;35;16;PT FREMONT NUSA METAL;NGORO INDUSTRI PERSADA;3516;[16] MOJOKERTO;Kawasan Industri;Ngoro Industrial Park;Kawasan Industri
4377;35;16;PT SIANTAR INTERNUSA AGENCY;NIP BLOK I-2B;3516;[16] MOJOKERTO;Kawasan Industri;Ngoro Industrial Park;Kawasan Industri
4378;35;16;PT INTERNUSA BROWNS INDONESIA;NGORO INDUSTRI PERSADA KAV I-3 NGORO MOJOKERTO;3516;[16] MOJOKERTO;Kawasan Industri;Ngoro Industrial Park;Kawasan Industri
4379;35;16;PT GLOBAL CARTON;NIP BLOK J3,5,6;3516;[16] MOJOKERTO;Kawasan Industri;Ngoro Industrial Park;Kawasan Industri
4380;35;16;PT SINAN BENANG JAHIT;KAWASAN NIP BLOK J-15;3516;[16] MOJOKERTO;Kawasan Industri;Ngoro Industrial Park;Kawasan Industri
4381;35;16;PT HUDIN METALINDO ABADI;KAWASAN NGORO INDUSTRI PERSADA BLOK J-2A;3516;[16] MOJOKERTO;Kawasan Industri;Ngoro Industrial Park;Kawasan Industri
4382;35;16;PT TARINDO UNIMETAL UTAMA;KAWASAN BERIKAT NGORO INDUSTRI PERSADA KAV F-8, NGORO, MOJOKERTO;3516;[16] MOJOKERTO;Kawasan Industri;Ngoro Industrial Park;Kawasan Industri
4383;35;16;PT PRESTO MEDICAL HOUSE;NGORO INDUSTRI PERSADA;3516;[16] MOJOKERTO;Kawasan Industri;Ngoro Industrial Park;Kawasan Industri
4384;35;16;PT MARUFUJI KENZAI INDONESIA;KAWASAN BERIKAT NIP BLOK F-1;3516;[16] MOJOKERTO;Kawasan Industri;Ngoro Industrial Park;Kawasan Industri
4385;35;16;PT MAHKOTA PLASTIK;NGORO INDUSTRI PERSADA;3516;[16] MOJOKERTO;Kawasan Industri;Ngoro Industrial Park;Kawasan Industri
4386;35;16;PT HON CHUAN INDONESIA;KAWASAN NIP BLOK F2 NO.01;3516;[16] MOJOKERTO;Kawasan Industri;Ngoro Industrial Park;Kawasan Industri
4387;35;16;PT INDONESIA TRI SEMBILAN;KAWASAN NIP BLOK I NO.01;3516;[16] MOJOKERTO;Kawasan Industri;Ngoro Industrial Park;Kawasan Industri
4388;35;16;PT PROFILINDAH KHARISMA;JL NGORO INDUSTRI BARAT II BLOK U NO 9-10, NGORO, KABUPATEN MOJOKERTO;3516;[16] MOJOKERTO;Kawasan Industri;Ngoro Industrial Park;Kawasan Industri
4389;35;16;PT LONG SOON INDONESIA;NGORO INDUSTRI PERSADA BLOK/KAV F-15-17;3516;[16] MOJOKERTO;Kawasan Industri;Ngoro Industrial Park;Kawasan Industri
4390;35;23;PT. HANSA PRATAMA;JALAN RAYA JENU TUBAN;3523;[23] TUBAN;Kawasan Industri;Kawasan Industri Tuban;Kawasan Industri
4391;35;23;PT. INDO MINA BAHARI;JALAN RAYA JENU TUBAN;3523;[23] TUBAN;Kawasan Industri;Kawasan Industri Tuban;Kawasan Industri
4392;35;23;PT. TEKNOTAMA LINGKUNGAN INTERNUSA;JALAN RAYA JENU TUBAN;3523;[23] TUBAN;Kawasan Industri;Kawasan Industri Tuban;Kawasan Industri
4393;35;23;PT. KAWASAN INDUSTRI GRESIK (#11);KARANGDOWO, SOCOREJO, KEC. JENU, KABUPATEN TUBAN, JAWA TIMUR 62352;3523;[23] TUBAN;Kawasan Industri;Kawasan Industri Tuban;Kawasan Industri
4394;35;23;PT. INDO LAUTAN BAHARI;KAWASAN INDUSTRI TUBAN, KAVLING D, JALAN RAYA SEMARANG-TUBAN SOCOREJO JENU, KAB. TUBAN, JAWA TIMUR;3523;[23] TUBAN;Kawasan Industri;Kawasan Industri Tuban;Kawasan Industri
4395;35;23;PT. WASTEC INTERNATIONAL;;;;;;Kawasan Industri
4396;35;24;PT. JAKAMITRA INDONESIA (#234);JL. RAYA DAENDELS KM. 65, DESA KEMANTREN, KEC. PACIRAN, KAB.LAMONGAN 62264 (KI I-SENTRA);3524;[24] LAMONGAN;Kawasan Industri;Lamongan Industrial Park;Kawasan Industri
4397;35;25;ARSYNERGY RESOURCES, PT;JL GAMMA KAWASAN INDUSTRI MASPION;3525;[25] GRESIK;Kawasan Industri;Maspion Industrial Estate;Kawasan Industri
4398;35;25;BINA KARYA PRIMA, PT;JL KIG RAYA BARAT KAV L 1 & 2;3525;[25] GRESIK;Kawasan Industri;Kawasan Industri Gresik;Kawasan Industri
4399;35;25;BUMI MANDIRI RESOURCES, PT;KIG RAYA BARAT KAV.I NO.2-3;3525;[25] GRESIK;Kawasan Industri;Kawasan Industri Gresik;Kawasan Industri
4400;35;25;CARGILL INDONESIA,PT;JL. BETA PLOT 2 KIM MANYAR GRESIK;3525;[25] GRESIK;Kawasan Industri;Maspion Industrial Estate;Kawasan Industri
4401;35;25;CIPTA MORTAR UTAMA, PT;KAWASAN INDUSTRI GRESIK, JL. KIG RAYA BARAT NO.1;3525;[25] GRESIK;Kawasan Industri;Kawasan Industri Gresik;Kawasan Industri
4402;35;25;COLORPAK INDONESIA TBK, PT;KIG RAYA SELATAN KAV. E.8;3525;[25] GRESIK;Kawasan Industri;Kawasan Industri Gresik;Kawasan Industri
4403;35;25;FRUITING INDONESIA, PT;JL.KIG RAYA BARAT NO22;3525;[25] GRESIK;Kawasan Industri;Kawasan Industri Gresik;Kawasan Industri
4404;35;25;HANAMPI SEJAHTERA KAHURIPAN, PT;KAWASAN INDUSTRI MASPION, JL. BETA MASPION BLOK I;3525;[25] GRESIK;Kawasan Industri;Maspion Industrial Estate;Kawasan Industri
4405;35;25;INOVASI INTEC PERSADA, PT;KAWASAN INDUSTRI MASPION, JL. BETA MASPION NO.25 RT.009/RW.002;3525;[25] GRESIK;Kawasan Industri;Maspion Industrial Estate;Kawasan Industri
4406;35;25;LIWAYWAY, PT;JL BETA II KAWASAN INDUSTRI MASPION;3525;[25] GRESIK;Kawasan Industri;Maspion Industrial Estate;Kawasan Industri
4407;35;25;PRIMERGY SOLUTION, PT;KIG RAYA SELATAN KAB.E 7;3525;[25] GRESIK;Kawasan Industri;Kawasan Industri Gresik;Kawasan Industri
4408;35;25;PT AIR PRODUCTS INDONESIA;KAWASAN INDUSTRI MASPION, JL. ALPHA MASPION LOT L-12;3525;[25] GRESIK;Kawasan Industri;Maspion Industrial Estate;Kawasan Industri
4409;35;25;PT HARMONI INDOJAYA ENERGI;JL KIG RAYA SELATAN KAV E-13;3525;[25] GRESIK;Kawasan Industri;Kawasan Industri Gresik;Kawasan Industri
4410;35;25;PT PANCER LIMA NUSANTARA;JL.KIG RAYA BARAT FB 19;3525;[25] GRESIK;Kawasan Industri;Kawasan Industri Gresik;Kawasan Industri
4411;35;25;SAMATOR INTIPEROKSIDA, PT;KAWASAN INDUSTRI, JL. KIG RAYA UTARA BLOK K KAV.12-20;3525;[25] GRESIK;Kawasan Industri;Kawasan Industri Gresik;Kawasan Industri
4412;35;25;SIKA INDONESIA, PT;JL KIG RAYA UTARA KAV.3-4;3525;[25] GRESIK;Kawasan Industri;Kawasan Industri Gresik;Kawasan Industri
4413;35;25;SUMBER BERSIH DUNIA, PT;JL KIG RAYA SELATAN A1;3525;[25] GRESIK;Kawasan Industri;Kawasan Industri Gresik;Kawasan Industri
4414;35;25;ADHIMIX PCI INDONESIA;"JL.	RAYA	MANYAR	KM	11,	KAB. GRESIK,	PROVINSI	JAWA	TIMUR KODE	POS	61151";3525;[25] GRESIK;Kawasan Ekonomi Khusus;Gresik;Kawasan Ekonomi Khusus
4415;35;25;AKR CORPORINDO;JL.RAYA MANYAR KM 11,KAWASAN JIIPE,KEK GRESIK BLOK A-7A DAN C-5A GRESIK 61151;3525;[25] GRESIK;Kawasan Ekonomi Khusus;Gresik;Kawasan Ekonomi Khusus
4416;35;25;AMBERCYCLE ADVANCED MATERIALS INDONESIA;"KAWASAN EKONOMI KHUSUS (KEK) GRESIK, JIIPE BLOK I-15
JALAN RAYA MANYAR KM.11 000/000";3525;[25] GRESIK;Kawasan Ekonomi Khusus;Gresik;Kawasan Ekonomi Khusus
4417;35;25;ANEKA TAMBANG;KAWASAN INDUSTRI JIIPE BLOK E-9;3525;[25] GRESIK;Kawasan Ekonomi Khusus;Gresik;Kawasan Ekonomi Khusus
4418;35;25;ANUGERAH KREASI PRATAMA INDONESIA;KAWASAN JIIPE, JALAN RAYA MANYAR KM. 11 MANYAR 000/000;3525;[25] GRESIK;Kawasan Ekonomi Khusus;Gresik;Kawasan Ekonomi Khusus
4419;35;25;ASIH EKA ABADI;JIIPE JAVA INTEGRATED INDUSTRIAL AND PORTS ESTATE JL. RAYA MANYAR KM. 11 MANYAR - GRESIK, JAWA TIMUR;3525;[25] GRESIK;Kawasan Ekonomi Khusus;Gresik;Kawasan Ekonomi Khusus
4420;35;25;BERKAH BUANA ENERGI;KAWASAN JIIPE, JALAN RAYA MANYAR KM.11 MANYAR, KABUPATEN GRESIK, JAWA TIMUR. 000/000;3525;[25] GRESIK;Kawasan Ekonomi Khusus;Gresik;Kawasan Ekonomi Khusus
