no;kdprov;kdkab;nama_perusahaan;alamat;kdprovkab;lblkab;kawasan_fasih;nama_kawasan;kawasan
2915;32;16;PT. MURAKAMI DELLOYD INDONESIA;JL. PASIR RANJI CIKARANG PUSAT;3216;[16] BEKASI;Kawasan Industri;Greenland International Industrial Center (GIIC);Kawasan Industri
2916;32;16;PT. SUGIYAMA INDONESIA;KAWASAN GREENLAND INTERNATIONAL INDUSTRIAL CENTER (GIIC) BLOK CF NO 10 KOTA DELTAMAS, KEL. PASIRRANJI, KEC. CIKARANG BARAT, KAB. BEKASI JAWA BARAT;3216;[16] BEKASI;Kawasan Industri;Greenland International Industrial Center (GIIC);Kawasan Industri
2917;32;16;INDO METAL MAKMUR, PT;JL.AKASIA 1 BLOK A5 NO.8,DELTASILICON 1;3216;[16] BEKASI;Kawasan Industri;Lippo Cikarang Industrial Park;Kawasan Industri
2918;32;16;VOESTALPINE BOHLER WELDING ASIA PACIFIC, PT;JL. INDUSTRI SELATAN 2, BLOK JJ NO.7-10,;;;;;Kawasan Industri
2919;32;16;DJOYOLINE PUSAKA INDONESIA;JL.JABABEKA I III H BLOK C NO. 17CT KAWASAN INDUSTRI JABABEKA I CIKARANG UTARA;;;;;Kawasan Industri
2920;32;16;SAMSUNG ELECTRONICS INDONESIA;JL JBBK RAYA BLOK F 29 NO 31 HARJAMEKAR CIKARANG UTARA;3216;[16] BEKASI;Kawasan Industri;Kawasan Industri Jababeka;Kawasan Industri
2921;32;16;BRIGHT FUTURE PRECISION METAL INDONESIA, PT;KAWASAN INDUSTRI DELTA SILIKON 8. 06D , JL ALBASIA UTARA NO.2;3216;[16] BEKASI;Kawasan Industri;Lippo Cikarang Industrial Park;Kawasan Industri
2922;32;16;JAEIL INDONESIA;JL. INDUSTRI UTAMA BLOK RR NO. 2A PASIRSARI, KAWASAN INDUSTRI JABABEKA 2 CIKARANG SELATAN;;;;;Kawasan Industri
2923;32;16;CAIRNHILL SERVIECHINTI, PT;KAWASAN DELTA COMMERCIAL PARK JL. KENARI JAYA BLOK B5-B6 JAYA MUKTI CIKARANG PUSAT;3216;[16] BEKASI;Kawasan Industri;Lippo Cikarang Industrial Park;Kawasan Industri
2924;32;16;PT JAYA METAL TEKNIKA;EJIP JLN,CISOKAN 5 PLOT 5B RW 1 SUKARESMI CIKARANG SELATAN KAB BEKASI;3216;[16] BEKASI;Kawasan Industri;East Jakarta Industrial Park;Kawasan Industri
2925;32;16;ASAHI CIPTA PRIMA, PT;BLOK OO NO. 3D KAWASAN INDUSTRI JABABEKA II;3216;[16] BEKASI;Kawasan Industri;Kawasan Industri Jababeka;Kawasan Industri
2926;32;16;PT MINEBEA ACCESSOLUTIONS INDONESIA;KAWASAN INDUSTRI MM 2100, JL. IRIAN BLOK NN NO.1, JATIWANGI, KEC. CIKARANG BAR., KABUPATEN BEKASI, JAWA BARAT 17530;;;;;Kawasan Industri
2927;32;16;PT. IFM ELECTRONIC INDONESIA;EJIP INDRUSTRIAL PARK NO,PLOT 3A SUKARESMI CIKARANG SELATAN;3216;[16] BEKASI;Kawasan Industri;East Jakarta Industrial Park;Kawasan Industri
2928;32;16;FOKUS DIAGNOSTIC INDONESIA, PT;DELTA SILIKON VIII, JL. ALBASIA RAYA BLOK K 08-006A;3216;[16] BEKASI;Kawasan Industri;Lippo Cikarang Industrial Park;Kawasan Industri
2929;32;16;KURNIA SELARAS SEJAHTERA, PT;JL.TREMBESI 1 DELTASILICON 3;3216;[16] BEKASI;Kawasan Industri;Lippo Cikarang Industrial Park;Kawasan Industri
2930;32;16;INFINI MOTOR TECHNOLOGIES, PT;BLOK L1 NO 9 JALAN MERANTI 1,SUKARESMI;;;;;Kawasan Industri
2931;32;16;ELECTRA MOBILITAS INDONESIA, PT;JALAN RAMIN III BLOK G7-01A KAWASAN DELTA SILICON 6, LIPPO CIKARANG;3216;[16] BEKASI;Kawasan Industri;Lippo Cikarang Industrial Park;Kawasan Industri
2932;32;16;FTS AUTOMOTIVE INDONESIA, PT;EJIP PLOT 8K -2 CITANDUY 6, CIKARANG SELATAN KAB. BEKASI;3216;[16] BEKASI;Kawasan Industri;East Jakarta Industrial Park;Kawasan Industri
2933;32;16;OMEGA TAIYO TEKNOLOGI, PT;JALAN INDUSTRI SELATAN I BLOK PP2F, KAWASAN INDUSTRI JABABEKA;3216;[16] BEKASI;Kawasan Industri;Kawasan Industri Jababeka;Kawasan Industri
2934;32;16;GAYA MOULD BASE, PT;JL. PALEM 2 NO.10, CIBATU;;;;;Kawasan Industri
2935;32;16;SATRINDO MITRA UTAMA,PT;BLOK A1 67;;;;;Kawasan Industri
2936;32;16;BINERKAT TANGGUH ABADI, PT;KAWASAN INDUSTRI JABABEKA II JL. INDUSTRI SELATAN VIII BLOK EE7-E;3216;[16] BEKASI;Kawasan Industri;Kawasan Industri Jababeka;Kawasan Industri
2937;32;16;GALLEON CAHAYA INVESTAMA, PT;JL.KAYU MANIS BLOK F 10 - 03 J KAWASAN INDUSTRI DELTA SILICON EXT III;3216;[16] BEKASI;Kawasan Industri;Lippo Cikarang Industrial Park;Kawasan Industri
2938;32;16;NIDEC INSTRUMENTS BEKASI, PT;JL MERANTI3 BLOK L8-6A DELTA SILICON1INDUSTRIAL PARK CIKARANG;3216;[16] BEKASI;Kawasan Industri;Lippo Cikarang Industrial Park;Kawasan Industri
2939;32;16;PRIMA NANO CAOTING, PT;JL. INDUSTRI SELATAN 7 BLOK FF IC;3216;[16] BEKASI;Kawasan Industri;Kawasan Industri Jababeka;Kawasan Industri
2940;32;16;LUMIERE DOREE METALINDO, PT;KAWASAN INDUSTRI & PERGUDANGAN MARUNDA CENTER BLOK T1 NO.9 JL. MARUNDA MAKMUR;;;;;Kawasan Industri
2941;32;16;EUROSEAT INDAH, PT;JALAN JABABEKA 2G BLOK C16 AK KAWASAN INDUSTRI JABABEKA RW.001;3216;[16] BEKASI;Kawasan Industri;Kawasan Industri Jababeka;Kawasan Industri
2942;32;16;MULTI TERAINDO;KAWASAN INDUSTRI DAN PERGUDANGAN MARUNDA CENTER BLOK A3 NO. 18;;;;;Kawasan Industri
2943;32;16;STAINLESS PRIMA PIPE;JALAN CEMPAKA I BLOK CC NOMOR 7, KAWASAN GIIC DELTAMAS;3216;[16] BEKASI;Kawasan Industri;Greenland International Industrial Center (GIIC);Kawasan Industri
2944;32;16;HYUN TECH PERKASA, PT;JL JABBEKA VI B BLOK J NO 7F;;;;;Kawasan Industri
2945;32;16;DYNAPLAST PLANT 3;KAWASAN INDUSTRI BIIE C1 NO.17 LIPPO CIKARANG;3216;[16] BEKASI;Kawasan Industri;Bekasi International Industrial Estate (BIIE);Kawasan Industri
2946;32;16;DYNAPLAST, PT;KAWASAN INDUSTRI BIIE, KOMP. HYUNDAI 21, JL. RAYA INDUSTRI BLOK C12 NO. 3A;3216;[16] BEKASI;Kawasan Industri;Bekasi International Industrial Estate (BIIE);Kawasan Industri
2947;32;16;VIRTUE DIAGNOSTICS INDONESIA;KAWASAN INDUSTRI JABABEKA, 7, KAV. B3B, WANGUNHARJA;;;;;Kawasan Industri
2948;32;16;KOSMETIKA GLOBAL HEALTH, PT;JL. CIUJUNG, PINTU II KAWASAB EJIP;;;;;Kawasan Industri
2949;32;16;TEMPO SCAN PACIFIC, PT;EJIP INDUSTRIAL PARK PLOT 1 G-H CIKARANG SELATAN BEKASI 17550;3216;[16] BEKASI;Kawasan Industri;East Jakarta Industrial Park;Kawasan Industri
2950;32;16;COMMOTRADE, PT;JABABEKA PARK 5 BLOK A 5A, TAHAP 7;3216;[16] BEKASI;Kawasan Industri;Kawasan Industri Jababeka;Kawasan Industri
2951;32;16;TOTAL SOLUSI WARNA;KAWASAN INDUSTRI JABABEKA 1, JL. JABABEKA 2E BLOK C NO. 16C;;;;;Kawasan Industri
2952;32;16;METACHEM CAHAYA INDONESIA, PT;KAWASAN INDUSTRI CENTRAL CIKARANG INDUSTRIAL PARK BLOK K17;3216;[16] BEKASI;Kawasan Industri;Central Cikarang Industrial Park (CCIP);Kawasan Industri
2953;32;16;SARANA KARYA MASINDO;KAWASAN INDUSTRI HYUNDAI, JL. INTI III NO. 8;3216;[16] BEKASI;Kawasan Industri;Bekasi International Industrial Estate (BIIE);Kawasan Industri
2954;32;16;SAN YING INDUSTRIAL;DELTA SILICON INDUSTRIAL PARK BLOK L5-01;3216;[16] BEKASI;Kawasan Industri;Lippo Cikarang Industrial Park;Kawasan Industri
2955;32;16;SUDO MANUFACTURING INDONESIA, PT;KAWASAN INDUSTRI MM2100 BLOK QQ-7;3216;[16] BEKASI;Kawasan Industri;MM2100 Industrial Town;Kawasan Industri
2956;32;16;NIHON SEIKI INDONESIA, PT;JL. ANGSANA RAYA NO.2 BLOK A5, SUKARESMI, CIKARANG SEL;3216;[16] BEKASI;Kawasan Industri;Lippo Cikarang Industrial Park;Kawasan Industri
2957;32;16;AZ TECS INDONESIA;JL. SCIENCE TIMUR 3 BLOK B5 E3 KAWASAN INDUSTRI JABABEKA V;3216;[16] BEKASI;Kawasan Industri;Kawasan Industri Jababeka;Kawasan Industri
2958;32;16;ARVICO ELECTRONICS INDONESIA;KAWASAN INDUSTRI JABABEKA I JL. JABABEKA XIV SFB BLOK J-12F;3216;[16] BEKASI;Kawasan Industri;Kawasan Industri Jababeka;Kawasan Industri
2959;32;16;AIMFOOD MANUFACTURING, PT;JL. SELAYAR BLOK B2-7;3216;[16] BEKASI;Kawasan Industri;MM2100 Industrial Town;Kawasan Industri
2960;32;16;LOGISTEED INDONESIA;JALAN INTI RAYA BLOK C10 NO 5;3216;[16] BEKASI;Kawasan Industri;Kawasan Industri Jababeka;Kawasan Industri
2961;32;16;MYGROWTEK JAYA IMAJIN;RENTAL FACTORY BUILDING BLOK A NO.8;;;;;Kawasan Industri
2962;32;16;PT. NX SHOJI INDONESIA;JL. HALMAHERA MM2100 INDUSTRIAL TOWN, BLOK DD-3 KABUPATEN BEKASI, JAWA BARAT, 17520 INDONESIA;;;;;Kawasan Industri
2963;32;16;LKG CELLTECH INDONESIA, PT;JL KENARI 1 BLOK G1 NO 21 DELTA SILICON 5 LIPPO CIKARANG;3216;[16] BEKASI;Kawasan Industri;Lippo Cikarang Industrial Park;Kawasan Industri
2964;32;16;BELLINTURF INDUSTRIAL INDONESIA;JL. RAYA INTI NO.12-A BLOK C3, CIBATU, CIKARANG SELATAN;3216;[16] BEKASI;Kawasan Industri;Bekasi International Industrial Estate (BIIE);Kawasan Industri
2965;32;16;AMER TECHNOLOGY INDONESIA,PT;KITIC;;;;;Kawasan Industri
2966;32;16;PT. STANDARD ENERGY INDONESIA;;;;;;Kawasan Industri
2967;32;16;LIBERA TECHNOLOGIES INDONESIA;KAWASAN INDUSTRI BIIE BLOK C2 KAV 7-9;3216;[16] BEKASI;Kawasan Industri;Bekasi International Industrial Estate (BIIE);Kawasan Industri
2968;32;16;CABLE TECH, PT;JL. MERANTI III BLOK L10 NO 10A-B DELTA SILICON 1 SUKARESMI CIKARANG SELATAN;3216;[16] BEKASI;Kawasan Industri;Lippo Cikarang Industrial Park;Kawasan Industri
2969;32;16;GALA NATURA KREASI,PT;KAWASAN JABABEKA TAHAP 7 KAV A 3A,WANGUNHARJA;3216;[16] BEKASI;Kawasan Industri;Kawasan Industri Jababeka;Kawasan Industri
2970;32;16;PT. NANYANG CHEMICHAL TECHNOLOGY INDONESIA;JL ANGGREK 1,SUKAMAHI CIKARANG PUSAT;;;;;Kawasan Industri
2971;32;16;PT. PEPSICO INDONESIA FOOD AND BEVERAGES;KAWASAN GIIC DESA SUKAMAHI KECAMATAN CIKARANG PUSAT;3216;[16] BEKASI;Kawasan Industri;Greenland International Industrial Center (GIIC);Kawasan Industri
2972;32;16;ASIA INDOPACK INDUSTRIES, PT;JL. JABABEKA RAYA E. 6-8 KAWASAN INDUSTRI JABABEKA;3216;[16] BEKASI;Kawasan Industri;Kawasan Industri Jababeka;Kawasan Industri
2973;32;16;ABYAKTA MITRA ABADI, PT;JL.NIAGA INDUSTRI SELATAN 2,BLOK QQ2-12, JABABEKA;3216;[16] BEKASI;Kawasan Industri;Kawasan Industri Jababeka;Kawasan Industri
2974;32;16;ADIPERKASA ROTO GRAVURE INDUSTRY;JALAN JABABEKA V BLOK V KAV 34-36, DS. HARJAMEKAR, CIKARANG UTARA;3216;[16] BEKASI;Kawasan Industri;Kawasan Industri Jababeka;Kawasan Industri
2975;32;16;ADVANTIS AKAZA INDONESIA;JL JABABEKA;3216;[16] BEKASI;Kawasan Industri;Kawasan Industri Jababeka;Kawasan Industri
2976;32;16;AIM SKINCARE MANUFAKTUR, PT;JL. SELAYAR NO. 7 BLOK B2;3216;[16] BEKASI;Kawasan Industri;MM2100 Industrial Town;Kawasan Industri
2977;32;16;AIRPRODUCTINDONESIA;JLJABABEKARAYABLOKF;;;;;Kawasan Industri
2978;32;16;ALAM SEJAHTRA MAJU;;;;;;Kawasan Industri
2979;32;16;ALDERON PRATAMA INDONESIA;DELTA SILICON 8 JL.ALBASIA RAYA NO.02 BLOK K6;3216;[16] BEKASI;Kawasan Industri;Lippo Cikarang Industrial Park;Kawasan Industri
2980;32;16;ANINDYA WIRAPUTRA KONSULT, PT;ANINDYA WIRAPUTRA KONSULT CABANG CIKARANG PT., JL. ROTAN NO.23C BLOK F27, CICAU, KEC. CIKARANG PUSAT, KABUPATEN BEKASI, JAWA BARAT 17530, INDONESIA;;;;;Kawasan Industri
2981;32;16;ARCELOR MITTAL NIPPON STEEL INDONESIA, PT;JL. SUMBAWA. 3 KAV. B1, KAWASAN INDUSTRI MM2100;3216;[16] BEKASI;Kawasan Industri;MM2100 Industrial Town;Kawasan Industri
2982;32;16;ARMINDO JAYA MANDIRI;KAWASAN INDUSTRI JABABEKA 2 BLOK FF 1 F JALAN INDUSTRI SELATAN 7 CIKARANG SELATAN;3216;[16] BEKASI;Kawasan Industri;Kawasan Industri Jababeka;Kawasan Industri
2983;32;16;ASTEM AIR SOLUTION INDONESIA, PT;JL. AKASIA 1 BLOK A-8 NO. 3 DELTA SILICON I;;;;;Kawasan Industri
2984;32;16;BATERAI LISTIK MOTORINDO;JL. TEKNO BOULEVARD BLOK DP 5F, JABABEKA III, PASIR GOMBONG, CIKARANG UTARA;;;;;Kawasan Industri
2985;32;16;BEAUTY LINKING HAIR PRODUCTS INDONESIA;JL.JABABEKA;;;;;Kawasan Industri
2986;32;16;BELLSONICA INDONESIA,PT;GREEN LAND INTERNATIONAL INDUSTRIAL CENTER BLOK AC NO.01, SUKAMAHI, KEC. CIKARANG PUSAT, KABUPATEN BEKASI, JAWA BARAT 17530;3216;[16] BEKASI;Kawasan Industri;Greenland International Industrial Center (GIIC);Kawasan Industri
2987;32;16;BEND.RUTIN KPBC TIPE A BEKASI;KAWASAN INDUSTRI MM2100 JL.SUMATERA BLOK D5 GANDA MEKAR CIKARANG BARAT 17520;3216;[16] BEKASI;Kawasan Industri;MM2100 Industrial Town;Kawasan Industri
2988;32;16;BESINDO,PT;JL.INTI II BLOK C10 NO 10;;;;;Kawasan Industri
2989;32;16;CAHAYA HASIL CEMERLANG MULTI SERVIS DAN KALIBRASI, PT;DELTA SILICON 3 JL.PINANG BLOK F23-15 LIPPO CIKARANG;;;;;Kawasan Industri
2990;32;16;DAIMLER COMMERCIAL VEHICLES MANUFACTURING INDONESIA, PT;JL. ALBASIA UTARA BLOK K1 NO. 10, 11,12,16,17,18,19,20 DELTA SILICON;3216;[16] BEKASI;Kawasan Industri;Lippo Cikarang Industrial Park;Kawasan Industri
2991;32;16;DAYA KOBELCO, PT;JL. HALMAHERA BLOK DD-10;;;;;Kawasan Industri
2992;32;16;DIBAO NEW ENERGY, PT;JL. INTI III BLOK C8/18;3216;[16] BEKASI;Kawasan Industri;Bekasi International Industrial Estate (BIIE);Kawasan Industri
2993;32;16;DUBBS ENERGI TEKNOLOGI, PT;KAWASAN INDUSTRI DELTA SILICON 3 JL JOHAR, F8, 25J, CICAU, CIKARANG PUSAT;3216;[16] BEKASI;Kawasan Industri;Bekasi International Industrial Estate (BIIE);Kawasan Industri
2994;32;16;DWIKARYA , PT;JABABEKA JL. TECHNO3 BLOK E -3G;;;;;Kawasan Industri
2995;32;16;DXM MOULD STEEL INDONESIA;JL. SUNGKAI 1 BLOK F.26 NO.10 KAWASAN INDUSTRI DELTA SILICON 3 LIPPO CIKARANG;3216;[16] BEKASI;Kawasan Industri;Lippo Cikarang Industrial Park;Kawasan Industri
2996;32;16;ELVINCO MED TECH, PT;KAWASAN INDUSTRI JABABEKA III, JL. TEKNO RAYA DP-11D;3216;[16] BEKASI;Kawasan Industri;Kawasan Industri Jababeka;Kawasan Industri
2997;32;16;EONCHEMICALS PUTRA, PT;JL. JABABEKA II BLOK C NO. 22;3216;[16] BEKASI;Kawasan Industri;Kawasan Industri Jababeka;Kawasan Industri
2998;32;16;FAPON BIOINDUSTRIES INDONESIA, PT;DESA JAYAMUKTI KEC CIKARANG PUSAT DELTA SILICON 6;;;;;Kawasan Industri
2999;32;16;FLORA FOOD MANUFACTURING INDONESIA;JABABEKA IX BLOK D1-29;3216;[16] BEKASI;Kawasan Industri;Kawasan Industri Jababeka;Kawasan Industri
3000;32;16;FOODINDO DWIVESTMA, PT;JL. INDUSTRI SELATAN IV BLOK GG NO. 56-5F;3216;[16] BEKASI;Kawasan Industri;Kawasan Industri Jababeka;Kawasan Industri
3001;32;16;FUJI IRONWORKSTEKNOLOGI, PT;JL GREENLAND III, BLOK KK BATAVIA AD 16 KOTA DELTAMAS;3216;[16] BEKASI;Kawasan Industri;Greenland International Industrial Center (GIIC);Kawasan Industri
3002;32;16;GARINDO FOOD INTERNATIONAL, PT;JL. INTI RAYA BLOK C10 NO 12 A;3216;[16] BEKASI;Kawasan Industri;Bekasi International Industrial Estate (BIIE);Kawasan Industri
3003;32;16;GARUDA MEIJI FLOW' [64] MM2100 INDUSTRIAL TOWN BFIE [29300] INDUSTRI SUKU CADANG DAN AKSESORI KENDARAAN BERMOTOR RODA EMPAT ATAU LEBIH 29300 TAMBAHAN JABAR 220725 PRELIST GARUDA MEIJI FLOW';;;;;;Kawasan Industri
3004;32;16;GARUDA METAL UTAMA;JLN MADURA 1 BLOK L16;3216;[16] BEKASI;Kawasan Industri;MM2100 Industrial Town;Kawasan Industri
3005;32;16;GOLD REGENT CRAFTS, PT;JL.TREMBESI CIKARANG PUSAT DELTA SILICON;;;;;Kawasan Industri
3006;32;16;PT GRAND MAJOR PACKAGING INDONESIA;KAWASAN INDUSTRI LIPPO LL BLOK G1-28 B & 28C, CIBATU, CIKARANG SELATAN;3216;[16] BEKASI;Kawasan Industri;Lippo Cikarang Industrial Park;Kawasan Industri
3007;32;16;HANGZHOU TURBINE SERVICES, PT;JLN. KENARI RAYA DELTA SILIKON 6 NO 01 CIKARANG PUSAT;;;;;Kawasan Industri
3008;32;16;HONGMING TRADE INDONESIA, PT;JL CENDANA RAYA BLOK F9 01B DS CICAU CIKARANG PUSAT;3216;[16] BEKASI;Kawasan Industri;Lippo Cikarang Industrial Park;Kawasan Industri
3009;32;16;ILJIN NEW TECHNOLOGY STEEL, PT;JLN. ALBASIA RAYA BLOK K03 NO. 02 KAWASAN DELTA SICON 8 DESA CICAU KECAMATAN CIKARANG PUSAT;3216;[16] BEKASI;Kawasan Industri;Lippo Cikarang Industrial Park;Kawasan Industri
3010;32;16;INDOLAKTO CIKARANG, PT;JL. KRANJI BLOK F-5 NO. 2APUSA;3216;[16] BEKASI;Kawasan Industri;East Jakarta Industrial Park;Kawasan Industri
3011;32;16;INDOTECH KARYA MANDIRI;NAGASARI KAV NO.49 SERANG BARU KITIC;;;;;Kawasan Industri
3012;32;16;INDOWIN INDUSTRIAL INDONESIA;KAWASAN INDUSTRI TERPADU INDONESIA CHINA, KITIC KAV 66A;;;;;Kawasan Industri
3013;32;16;INTI KARYA BAJA LESTARI;DELTAMAS CILAR@NG PUSAT KAVLING 35 GIIC;;;;;Kawasan Industri
3014;32;16;JAVASARI MITRA PRIMA;JL JABABEKA RAYA BLOK Q NO 1;3216;[16] BEKASI;Kawasan Industri;Kawasan Industri Jababeka;Kawasan Industri
3015;32;16;JAYA REFRIGERATION EQUIPMENT;JL JABABEKA RAYA Q NO 1 WANGUNHARJA CIKARANG UTARA;3216;[16] BEKASI;Kawasan Industri;Kawasan Industri Jababeka;Kawasan Industri
3016;32;16;JINGUAN ELECTRIC INDONESIA, PT;CICAU, KEC. CIKARANG PUSAT, KABUPATEN BEKASI, JAWA BARAT 17530;;;;;Kawasan Industri
3017;32;16;JOTUN INDONESIA PLANT 1;JL, IRIAN III, BLOK KK1, KAWASAN INDUSTRI MM2100NO NI;;;;;Kawasan Industri
3018;32;16;KALDEN INDONESIA;JL. JABABEKA 2 NO.28 CIKARANG BLOK C/27, PASIRGOMBONG, KEC. CIKARANG UTARA 17530;3216;[16] BEKASI;Kawasan Industri;Kawasan Industri Jababeka;Kawasan Industri
3019;32;16;KALIBRATOR UJI UTAMA;JALAN JABABEKA;;;;;Kawasan Industri
3020;32;16;PT KARUNIA JASINDO;LIPPO CIKARANG, KAWASAN INDUSTRI DELTA SILICON VIII JL.ABASIA RAYA NO.18 BLOK K3 CICAU KECAMATAN CIKARANG PUSAT KABUPATEN BEKASI JAWA BARAT 17530;3216;[16] BEKASI;Kawasan Industri;Bekasi International Industrial Estate (BIIE);Kawasan Industri
3021;32;16;KBG HOLDINGS CO.,LTD;EJIP CENTER BUILDING, EJIP INDRUSTRIAL PARK PLOT 3A;;;;;Kawasan Industri
3022;32;16;KERTOPATEN KENCANA, PT;JL. SELAYAR V NO. 2 KAWASAN MM2109;3216;[16] BEKASI;Kawasan Industri;MM2100 Industrial Town;Kawasan Industri
3023;32;16;KINGFA SCI AND TECH INDONESIA, PT;JLN. RAMIN V NO G6 17C SD G6 -17 K DWLTA SILICON VL CIBATU CIKARANG PUSAT;;;;;Kawasan Industri
3024;32;16;PT. KAWASAN INDUSTRI TERPADU INDONESIA CHINA;JL. KAWASAN INDUSTRI TERPADU INDONESIA CHINA KAV.35, GIIC-KOTA DELTAMAS (TOL JAKARTA - CIKAMPEK KM.37) INDONESIA;3216;[16] BEKASI;Kawasan Industri;Kawasan Industri Terpadu Indonesia China;Kawasan Industri
3025;32;16;KITO INDONESIA, PT;JL.KENARI RAYA BLOK G2 NO 10A KAWASAN INDUSTRI DELTA SILICON 5 LIPPO CIKARANG;;;Kawasan Industri;Lippo Cikarang Industrial Park;Kawasan Industri
3026;32;16;KOREA HIGHTECH INDONESIA, PT;DELTA SILICON 3. JLN. SUNGKAI I BLOK F26-1AA CIKARANG PUSAT;3216;[16] BEKASI;Kawasan Industri;Lippo Cikarang Industrial Park;Kawasan Industri
3027;32;16;KUEI MENG CHAIN INDONESIA, PT;JALAN KAWASAN INDUSTRI TERPADU INDONESIA CHINA (KITIC) KAVELLING 19-4;3216;[16] BEKASI;Kawasan Industri;Greenland International Industrial Center (GIIC);Kawasan Industri
3028;32;16;LINTAS DIRGA NUSANTARA;JL. SCIENCE TIMUR 3, BLOK B-5H DESA JAYAMUKTI, CIKARANG PUSAT KAB. BEKASI ? JAWA BARAT, 17531 TEL: (62-21) 55 955 845;;;;;Kawasan Industri
3029;32;16;MILLENNIUM INFRAMACH DISTRIBUSI INDONESIA;JABABEKA INDUSTRIAL ESTATE,JL.SCIENCE BOULEVARD BLOK A NO 5B;;;;;Kawasan Industri
3030;32;16;MINEBEA MITSUMI,PT;JL IRIAN BLOK NN MM2100;;;;;Kawasan Industri
3031;32;16;MITRA MAKMUR UTAMA, PT;SUKAMAHI, KEC. CIKARANG PUSAT, KABUPATEN BEKASI, JAWA BARAT 17530;;;;;Kawasan Industri
3032;32;16;MODAGRAFUCS AUTO INDONESIA, PT;JL JABABEKA 1KAV 1E4-5;;;;;Kawasan Industri
3033;32;16;MUFG BANK, LTD;JAKARTA INDUSTRIAL ESTATE PLOT 3A JLN.CISOKAN;;;;;Kawasan Industri
3034;32;16;NAYA CHEMICAL INDUSTRY;KAV 19-5 KAWASAN KITIC;3216;[16] BEKASI;Kawasan Industri;Kawasan Industri Terpadu Indonesia China;Kawasan Industri
3035;32;16;NEOPLATECH IMDONESIA, PT/NEOHYOLIM PLATECH INDONESIA, PT;JLN . SUMBAWA I NO. 3 BLOK A 8;3216;[16] BEKASI;Kawasan Industri;MM2100 Industrial Town;Kawasan Industri
3036;32;16;NOBEL RIGGINDO SAMUDRA;DELTA SILICON 2 JALAN KARET 4, CIBATU, KABUPATEN BEKASI, JAWA BARAT;3216;[16] BEKASI;Kawasan Industri;Lippo Cikarang Industrial Park;Kawasan Industri
3037;32;16;OPTIMA ELEKTRONIK MANUFAKTUR, PT;JL. INDUSTRI SELATAN V NO. 1L BLOK FF;3216;[16] BEKASI;Kawasan Industri;Kawasan Industri Jababeka;Kawasan Industri
3038;32;16;PECCA GEMILANG INDONESIA, PT;DELTA SILICON 3, JL. SUNGKAI TIMUR BLOK F26, CICAU, LIPPO CIKARANG, KABUPATEN BEKASI, JAWA BARAT 17530;3216;[16] BEKASI;Kawasan Industri;Lippo Cikarang Industrial Park;Kawasan Industri
3039;32;16;POLY COLOR PRIMA PERKASA, PT;JL JABABEKA XVIIA BLOK V NO 83B;;;;;Kawasan Industri
3040;32;16;PRIMA SARANA MAKMUR;JL. JABABEKA LL INDUSTRI SELATAN VLLL BLOK EE NO 9 CIKARANG SELATAN;;;;;Kawasan Industri
3041;32;16;PT DAIMOTO INDONESIA;JABABEKA 1.BLOK T1 GH JL.JABABEKA 1V;;;;;Kawasan Industri
3042;32;16;PT GOLDION;;;;;;Kawasan Industri
3043;32;16;LUMOS BUILDING MATERIALS, PT;MM2100 INDUSTRIAL TOWN, JL. SULAWESI II BLOK F5, GANDAMEKAR, KEC. CIKARANG BAR., KABUPATEN BEKASI, CIKARANG, JAWA BARAT 17520;3216;[16] BEKASI;Kawasan Industri;MM2100 Industrial Town;Kawasan Industri
3044;32;16;PT MITSUBA PIPE PART;KAWASAN INDUSTRI MM2100, BLOK NN 12, JATIWANGI CIKARANG BARAT KAB BEKASI;;;;;Kawasan Industri
3045;32;16;SHENGLI MACHINERY MANUFACTURING, PT;JL CIUJUNG PLOT 9D, SUKARESMI, CIKARANG SELATAN, JAWA BARAT;3216;[16] BEKASI;Kawasan Industri;East Jakarta Industrial Park;Kawasan Industri
3046;32;16;PT SMC AUTOMATION INDONESIA;EJIP PLOT 6 J NO. 1,SUKARESMI, CIKARANG SELATAN;3216;[16] BEKASI;Kawasan Industri;East Jakarta Industrial Park;Kawasan Industri
3047;32;16;PT SPININDO MITRADAYA;KAWASAN INDUSTRIAL EJIP, JL CISOKAN NOMOR : PLOT 8M-1 KEL. SUKARESMI KEC. CIKARANG SELATAN KAB. BEKASI JAWA BARAT;;;;;Kawasan Industri
3048;32;16;PT UNITED STEEL CENTER PLAN CIBITUNG USC;JL. SULAWESI 1 BLOK H-4-1 KAWASAN INDUSTRI MM2100;;;;;Kawasan Industri
3049;32;16;PT. ANGKASA PURA LOGISTIK;KAWASAN INDUSTRI DAN PERGUDANGAN MARUNDA CENTER BLOK E NO 59 SAGARA MAKMUR TARUMAJAYA KABUPATEN BEKASI JAWA BARAT 17211;;;;;Kawasan Industri
3050;32;16;PT. ARTHA MEGA SERINDO KONSTRUKSI;KAWASAN INDUSTRI DAN PERGUDANGAN MARUNDA CENTER BLOK E NO 6 DESA SAGARA MAKMUR TARUMAJAYA KABUPATEN BEKASI JAWA BARAT 17211;;;;;Kawasan Industri
3051;32;16;PT. BANK MANDIRI ( PERSERO ) TBK;KAWASAN INDUSTRI MM2100, JL KALIMANTAN BLOK B2 GANDA MEKAR;;;;;Kawasan Industri
3052;32;16;PT. BERKAH SAWIT NUSANTARA;KAWASAN INDUSTRI DAN PERGUDANGAN MARUNDA CENTER BLOK H1 NO.1 JLN MARUNDA MAKMUR SAGARA MAKMUR TARUMAJAYA KABUPATEN BEKASI JAWA BARAT 17211;;;;;Kawasan Industri
3053;32;16;PT. CAHAYA KALIMAS UTAMA;JL ARU BLOK L NO 1, KAWASAN INDUSTRI MM2100;;;;;Kawasan Industri
3054;32;16;PT. CAHAYA SAMOEDRA BERSAUDARA;KAWASAN INDUSTRI DAN PERGUDANGAN MARUNDA CENTER BLOK P NO 3 DESA SAGARA MAKMUR TARUMAJAYA KABUPATEN BEKASI JAWA BARAT 17211;;;;;Kawasan Industri
3055;32;16;PT. CEMERLANG MANDIRI ABADI;KAWASAN INDUSTRI DAN PERGUDANGAN MARUNDA CENTER BLOK L NO 3 DESA SAGARA MAKMUR TARUMAJAYA KABUPATEN BEKASI JAWA BARAT 17211;3216;[16] BEKASI;Kawasan Industri;Greenland International Industrial Center 2 (GIIC 2);Kawasan Industri
3056;32;16;PT. CHANDRA PURNALAND (#236);KAWASAN INDUSTRI CENTRAL CIKARANG INDUSTRIAL PARK. DESA CICAU CIKARANG PUSAT KAB BEKASI;;;;;Kawasan Industri
3057;32;16;PT. DAISEI LOG INDONESIA;KAWASAN GIIC BLOK CJ 1 NO. 9;3216;[16] BEKASI;Kawasan Industri;Greenland International Industrial Center (GIIC);Kawasan Industri
3058;32;16;PT. EAST JAKARTA INDUSTRIAL PARK (#47);EJIP INDUSTRIAL PARK, JALAN CISOKAN 1 PLOT 3A;3216;[16] BEKASI;Kawasan Industri;East Jakarta Industrial Park;Kawasan Industri
3059;32;16;PT. EQUIPINDO PERKASA;KAWASAN INDUSTRI DAN PERGUDANGAN MARUNDA CENTER BLOK A3 NO 6-12 JLN MARUNDA MAKMUR, SAGARA MAKMUR TARUMAJAYA KABUPATEN BEKASI JAWA BARAT 17211;;;;;Kawasan Industri
3060;32;16;PT. ESR INDONESIA PROPERTIES ONE;JL. CEMPAKA RAYA DESA PASIRRANJI KEC. CIKARANG PUSAT;;;;;Kawasan Industri
3061;32;16;PT. FAJAR BAHARI NUSANTARA;JL. KAWASAN MARUNDA CENTER, SAGARA MAKMUR, KEC. TARUMAJAYA, KABUPATEN BEKASI, JAWA BARAT 17212;3216;[16] BEKASI;Kawasan Industri;Kawasan Industri Marunda Center;Kawasan Industri
3062;32;16;PT. GARUDA NUSANTARA STEEL;KAWASAN INDUSTRI DAN PERGUDANGAN MARUNDA CENTER BLOK I-10 DESA SAGARA MAKMUR;3216;[16] BEKASI;Kawasan Industri;Kawasan Industri Marunda Center;Kawasan Industri
3063;32;16;PT. GIVAUDAN INDONESIA;KAWASAN GIIC DS.NAGASARI, KEC. SERANG BARU;3216;[16] BEKASI;Kawasan Industri;Kawasan Industri Terpadu Indonesia China;Kawasan Industri
3064;32;16;PT. GLOBAL CHEMINDO MEGATRADING;KAWASAN DELTAMAS GIIC BLOK BB NO.05A, SUKAMAHI, KEC. CIKARANG PUSAT, KABUPATEN BEKASI, JAWA BARAT 17530;;;;;Kawasan Industri
3065;32;16;PT. GLOBAL DIGITAL NIAGA;KAWASAN INDUSTRI DAN PERGUDANGAN MARUNDA CENTER BLOK V NO.1 DESA PANTAI MAKMUR TARUMAJAYA KABUPATEN BEKASI JAWA BARAT 17212;;;;;Kawasan Industri
3066;32;16;PT. GUNA TESUMA INTERNATIONAL;KAWASAN INDUSTRI DAN PERGUDANGAN MARUNDA CENTER BLOK I NO 12A;;;;;Kawasan Industri
3067;32;16;PT. HARMONI NUSA RAYA;KAWASAN INDUSTRI DAN PERGUDANGAN MARUNDA CENTER BLOK P NO. 2 SAGARA MAKMUR TARUMAJAYA KABUPATEN BEKASI JAWA BARAT 17211;;;;;Kawasan Industri
3068;32;16;PT. HEAVY EQUIPMENT SINOGROUP;KAWASAN INDUSTRI DAN PERGUDANGAN MARUNDA CENTER BLOK F12/B SAGARA MAKMUR TARUMAJAYA KABUPATEN BEKASI JAWA BARAT 17212;;;;;Kawasan Industri
3069;32;16;PT. HLN RUBBER JAKARTA;KAWASAN INDUSTRI PLOT 3A. JLN CISOKAN 1 CIKARANG SELATAN BEKASI 17530;3216;[16] BEKASI;Kawasan Industri;Lippo Cikarang Industrial Park;Kawasan Industri
3070;32;16;PT. IGAS UTAMA;JL JAWA BLOK M-32-1 KAWASAN INDUSTRI MM2100 JL JAWA BLOK M-32-1 KAWASAN INDUSTRI MM210;;;;;Kawasan Industri
3071;32;16;PT. INDOFRESH;KAWASAN INDUSTRI DAN PERGUDANGAN MARUNDA CENTER BLOK E NO 34 DESA SAGARA MAKMUR TARUMAJAYA KABUPATEN BEKASI JAWA BARAT 17211;;;;;Kawasan Industri
3072;32;16;PT. INDOINTERNET TBK;;;;;;Kawasan Industri
3073;32;16;PT. INDONESIA TECHNICAL MACHINERY;KAWASAN INDUSTRI DAN PERGUDANGAN MARUNDA CENTER BLOK S NO.16 SAGARA MAKMUR TARUMAJAYA KABUPATEN BEKASI JAWA BARAT 17211;;;;;Kawasan Industri
3074;32;16;PT. INTERASIA;KAWASAN MARUNDA CENTER BLOK E NO.57;3216;[16] BEKASI;Kawasan Industri;Kawasan Industri Marunda Center;Kawasan Industri
3075;32;16;PT. INTI LINGGA SUKSES;KAWASAN MARUNDA CENTER NO 12;3216;[16] BEKASI;Kawasan Industri;Kawasan Industri Marunda Center;Kawasan Industri
3076;32;16;PT. JAYA INTI PERSADA;KAWASAN MARUNDA CENTER BLOK L NO.7;3216;[16] BEKASI;Kawasan Industri;Kawasan Industri Marunda Center;Kawasan Industri
3077;32;16;PT. JAYANTARA SETIA SEJAHTERA;KAWASAN MARUNDA CENTER BLOK R1 NO.7;3216;[16] BEKASI;Kawasan Industri;Kawasan Industri Marunda Center;Kawasan Industri
3078;32;16;PT. JIMSHONEY INDONESIA PRATAMA;KAWASAN MARUNDA CENTER JL.SAGARA MAKMUR BLOK S NO.15;3216;[16] BEKASI;Kawasan Industri;Kawasan Industri Marunda Center;Kawasan Industri
3079;32;16;PT. KURNIADI PERDANA GRAHA;KAWASAN INDUSTRI MARUNDA CENTER BLOK B;;;;;Kawasan Industri
3080;32;16;PT. LANCAR INDOTAMA MANDIRI;KAWASAN MARUNDA CENTER, DESA PANTAI MAKMUR;;;;;Kawasan Industri
3081;32;16;PT. LANCAR JAYA MULIA;KAWASAN MARUNDA CENTER BLOK 1 NO.8;;;;;Kawasan Industri
3082;32;16;PT. LINDA HARTA WIJAYA;KAWASAN MARUNDA CENTER BLOK A NO.15;;;;;Kawasan Industri
3083;32;16;PT. LINTAS BUANA EKSPRESS;KAWASAN MARUNDA CENTER BLOK B NO 1-41;;;;;Kawasan Industri
