no;kdprov;kdkab;nama_perusahaan;alamat;kdprovkab;lblkab;kawasan_fasih;nama_kawasan;kawasan
1580;32;15;KERAMIKA INDONESIA ASSOSIASI, PT;J88G+W9J, KUTAMEKAR, KEC. CIAMPEL, KARAWANG, JAWA BARAT 41363 91 M;3215;[15] KARAWANG;Kawasan Industri;Suryacipta IE;Kawasan Industri
1581;32;15;MIURA INDONESIA, PT;JL HARAPAN RAYA LOT KK - 10 KAWASAN KIIC - KARAWANG;3215;[15] KARAWANG;Kawasan Industri;Karawang International Industrial City;Kawasan Industri
1582;32;15;SANGHIANG PERKASA, PT;KAWASAN INDUSTRI INDOTAISEI;;;;;Kawasan Industri
1583;32;15;JIDOSHA BUHIN INDONESIA, PT;JL MAILGI L1 LOT C 7 D KARAWANG INDUATRI;3215;[15] KARAWANG;Kawasan Industri;Karawang International Industrial City;Kawasan Industri
1584;32;15;ART PISTON INDONESIA, PT;KAWASAN SURYA CIPTA KUTANEGARA, KEC. CIAMPEL, KARAWANG, JAWA BARAT 41363 38 M;3215;[15] KARAWANG;Kawasan Industri;Suryacipta IE;Kawasan Industri
1585;32;15;DAIKYONISHIKAWA TENMA INDONESIA.PT;KAWASAN INDUSTRI SURYACIPTA JL. SURYA KENCANA KAV 1-18D;3215;[15] KARAWANG;Kawasan Industri;Suryacipta IE;Kawasan Industri
1586;32;15;TOYO BP INDONESIA,PT;JL. SURYA NUSA 1 KAV.B18 KAWASAN INDUSTRY SURYA CIPTA;;;;;Kawasan Industri
1587;32;15;PT. GLICO MANUFACTURING INDONSIA;JL. INDUSTRI III, LOT MM 16-18, KAWASAN INDUSTRI KIIC, DS. MARGAMULYA, KEC. TELUKJAMBE BARAT, KAB. KARAWANG;3215;[15] KARAWANG;Kawasan Industri;Karawang International Industrial City;Kawasan Industri
1588;32;15;KYORAKU BLOWMOLDING INDONESIA PT;JL MALIGI 3 LOT F9 KAWASAN INDUSTRI KIIC;3215;[15] KARAWANG;Kawasan Industri;Karawang International Industrial City;Kawasan Industri
1589;32;15;SHIN SAM PLUS INDUSTRY,PT;JL PERMATA RAYA LOT E-1 KIIC DESA SUKALUYU KECAMATAN TELUKJAMBE TIMUR;;;;;Kawasan Industri
1590;32;15;PT. IFONE INDONESIA;JL. JEND. ACHMAD YANI NOMOR 39, KAVLING 17, DESA KALIHURIP, KECAMATAN CIKAMPEK, KABUPATEN KARAWANG , PROVISI JAWA BARAT - 41373;3215;[15] KARAWANG;Kawasan Industri;Kujang Industrial Estate (KIE);Kawasan Industri
1591;32;15;RARLON METAL INDONESIA;JL AHMAD YANI NO39 KALIHURIP KEC CIKAMPEK KARAWANG JAWA BARAT;3215;[15] KARAWANG;Kawasan Industri;Kujang Industrial Estate (KIE);Kawasan Industri
1592;32;15;PT. ALUMINDO ALLOY ABADI;JL MALIGI 1 LOT B-5;;;;;Kawasan Industri
1593;32;15;PT. LSAG CABLE INDONESIA;KAWASAN ARTHA;;;;;Kawasan Industri
1594;32;15;YKT GEAR INDONESIA, PT;JL. MITRA BARAT II BLOK I NO.7 KIM;;;;;Kawasan Industri
1595;32;15;CENTRAL MOTOR WHEEL INDONESIA,PT;KAWASAN INDUSTRI SURYACIPTA, JL. SURYA MADYA VI, KAV. I-59,;3215;[15] KARAWANG;Kawasan Industri;Suryacipta IE;Kawasan Industri
1596;32;15;PT DAIHATSU DRIVETRAIN MANUFACTURING INDONESIA;JALAN SURYA MADYA VI KUTANEGARA KEC CIAMPEL KARAWANG JAWA BARAT;;;;;Kawasan Industri
1597;32;15;PT HONDA PROSPECT MOTOR;JLN MITRA UTARA II KAWASAN INDUSTRI MITRA KARAWANG;3215;[15] KARAWANG;Kawasan Industri;Lippo Cikarang Industrial Park;Kawasan Industri
1598;32;15;INKOASKU, PT;KAWASAN INDUSTRI SURYA CIPTA -. SURYA UTAMA KAV I-65 A2;3215;[15] KARAWANG;Kawasan Industri;Suryacipta IE;Kawasan Industri
1599;32;15;INTI PANTJA PRESS INDUSTRI, PT;JL SURYA UTAMA KAV.1 -65 B 2A;3215;[15] KARAWANG;Kawasan Industri;Suryacipta IE;Kawasan Industri
1600;32;15;MITSUI KINZOKU CATALYSTS JAKARTA PT;JL. SURYA KENCANA KAV. 1M-1E KAWASAN INDUSTRI SURYA CIPTA;3215;[15] KARAWANG;Kawasan Industri;Suryacipta IE;Kawasan Industri
1601;32;15;ZINUS GLOBAL INDONESIA;JL. SURYA MADYA XIII/XIV KAV. I-68 H;3215;[15] KARAWANG;Kawasan Industri;Suryacipta IE;Kawasan Industri
1602;32;15;PT. TOYOTA BOSHOKU INDONESIA;JL HARAPAN VIII LOT LL 7A KAWASAN INDUSTI KIIC, PARUNG MULYA - CIAMPEL;;;;;Kawasan Industri
1603;32;15;PT. INDONESIA THAI SUMMIT PLASTTECH;JL. PERMATA RAYA LOT. FF - 5;;;;;Kawasan Industri
1604;32;15;ZTT CABLE INDONESIA,PT;SURYA CIPTA;3215;[15] KARAWANG;Kawasan Industri;Suryacipta IE;Kawasan Industri
1605;32;15;SUGITY CREATIVES, PT;KAWASAN INDUSTRI KIIC, JL PERMATA 3 TELUK JAMBE TIMUR;3215;[15] KARAWANG;Kawasan Industri;Karawang International Industrial City;Kawasan Industri
1606;32;15;SIGNIFY COMMERCIAL INDONESIA;JL. SURYA MADYA KAV I-15DI, KAWASAN INDUSTRI SURYACIPTA;3215;[15] KARAWANG;Kawasan Industri;Suryacipta IE;Kawasan Industri
1607;32;15;PT. G-TEKT INDONESIA MANUFACTURING;KAWASAN INDUSTRI INDOTAISEI SEKTOR 1A BLOK N , DESA KALIHURIP , KECAMATAN CIKAMPEK , KABUPATEN KARAWANG;;;;;Kawasan Industri
1608;32;15;SUN TOWARD TECH INDONESIA, PT;JL MALIGI V LOT U3DAN U4 DS.MARGAKAYA KEC TELUK JAMBE BARAT KAB KARAWANG 41361;;;;;Kawasan Industri
1609;32;15;GULBRANDSEN TECHNOLOGIES INDONESIA PT;JL. SURYA MADYA KAWASAN INDUSTRI SURYACIPTA KAV.I-T5B2, KUTAMEKAR, CIAMPEL, KARAWANG, WEST JAVA 41363;3215;[15] KARAWANG;Kawasan Industri;Suryacipta IE;Kawasan Industri
1610;32;15;PT. F-TECH INDONESIA;JL. MALIGI IX LOT. V-3, KAWASAN INDUSTRI KIIC;3215;[15] KARAWANG;Kawasan Industri;Karawang International Industrial City;Kawasan Industri
1611;32;15;PT. MAGDATAMA MULTI INDUSTRI;JL MALIGI RAYA LOT P-48, KAWASAN INDUSTRI KIIC KARAWANG;;;;;Kawasan Industri
1612;32;15;DAESANG FOOD INDONESIA, PT;SURYACIPTA CITY OF INDUSTRY, JL. SURYA UTAMA KAV. I-25 B;3215;[15] KARAWANG;Kawasan Industri;Suryacipta IE;Kawasan Industri
1613;32;15;LIMA TEKNO INDONESIA;KAWASAN INDUSTRI SURYACIPTA KAV I-15B, JL. SURYA MADYA, KUTAMEKAR, KEC. CIAMPEL, KARAWANG, JAWA BARAT 41361;3215;[15] KARAWANG;Kawasan Industri;Suryacipta IE;Kawasan Industri
1614;32;15;PRIMUS SANUS COOKING OIL INDUSTRIAL,PT;JL.SURYA UTAMA KAV.1-4 SURYA CIPTA CITY;3215;[15] KARAWANG;Kawasan Industri;Suryacipta IE;Kawasan Industri
1615;32;15;PT. VOITH PAPER ROLLS INDONESIA;JL. PERMATA V LOT EE-1;3215;[15] KARAWANG;Kawasan Industri;Karawang International Industrial City;Kawasan Industri
1616;32;15;MOLD & DIES INDONESIA, PT;JL. SURYA MADYA KA.A-6 KAWASAN INDUSTRI SURYA CIPTA KARAWANG;;;;;Kawasan Industri
1617;32;15;SANY INDONESIA MACHINERY, PT;JL. RAYA MITRA BLOK C1,2,9,10;3215;[15] KARAWANG;Kawasan Industri;Kawasan Industri Mitrakarawang;Kawasan Industri
1618;32;15;ROKI INDONESIA,PT;SURYA CIPTA CITY OF INDONESIA,JLN SURYA UTAMA KAV1-65E11;3215;[15] KARAWANG;Kawasan Industri;Suryacipta IE;Kawasan Industri
1619;32;15;KEN YUKAGEN INDONESIA PT;JL. SURYANUSA I, KAVLING B23 - B26;;;;;Kawasan Industri
1620;32;15;PT. INDOCIPTA HASTA PERKASA;KOTA BUKIT INDAH KAWASAN INDUSTRI INDOTAISEI SEKTOR 1A BLOK F2, KEL. KALIHURIP, KEC. CIKAMPEK, KARAWANG;;;;;Kawasan Industri
1621;32;15;B BRAUN PHARMACEUTICAL INDONESIA PT;KAWASAN INDUSTRI INDOTAISE;3215;[15] KARAWANG;Kawasan Industri;Kawasan Industri Indotaisei (Kota Bukit Indah);Kawasan Industri
1622;32;15;PT. HUA YII INDONESIA;JL. HARAPAN VII, LOT LL-4A KAWASAN INDUSTRI KIIC, TELUKJAMBE TIMUR, SIRNABAYA, KARAWANG JAWA BARAT.;;;;;Kawasan Industri
1623;32;15;PT. 3M INDONESIA;JL. MALIGI VIII. LOT R-2 KAWASAN INDUSTRI KIIC KARAWANG BARAT, PROVINSI JAWA BARAT;3215;[15] KARAWANG;Kawasan Industri;Karawang International Industrial City;Kawasan Industri
1624;32;15;MANE INDONESIA PT;KAWASAN INDUSTRI INDOTAISEI SEKTOR IA BLOK K4;3215;[15] KARAWANG;Kawasan Industri;Kawasan Industri Indotaisei (Kota Bukit Indah);Kawasan Industri
1625;32;15;KERRY INGREDIENTS INDONESIA PT;KAWASAN INDUSTRI KIIC;3215;[15] KARAWANG;Kawasan Industri;Kawasan Industri Jababeka;Kawasan Industri
1626;32;15;PT DATACENTER INDONESIA SUKSES MAKMUR (DISM);PERTIWI LESTARI INDUSTRIAL ESTATE BLOK A-VI NO. 1C DESA WANAJAYA, KEC. TELUKJAMBE BARAT KARAWANG, JAWA BARAT;;;;;Kawasan Industri
1627;32;15;PT. ILC LOGISTICS INDONESIA (WAREHOUSE);JL. SURYA UTAMA KAV. I-65 C1, KAWASAN INDUSTRI SURYACIPTA;;;;;Kawasan Industri
1628;32;15;EVERPRO INDONESIA TECHNOLOGIES, PT;KAWASAN INDUSTRI SURYA CIPTA JL. SURYA MADYA XII KAVELING I-65 E7B;;;;;Kawasan Industri
1629;32;15;APM AUTO COMPONENTS INDONESIA (APM LEAF SPRING INDONESIA);SURYA CIPTA CITY OF INDUSTRY.JLN SURYA KENCANA KAV-1-MIJKNA;;;;;Kawasan Industri
1630;32;15;ASTRA DAIHATSU MOTOR KARAWANG ASSEMBLY PLANT,PT;JL.SURYA PRATAMA KAV 50 ,KAWASAN SURYA CIPTA;;;;;Kawasan Industri
1631;32;15;ATSUMITEC INDONESIA, PT;JL. SURYA MADYA KAV 1-29 AB KAWASAN INDUSTRI SURYA CIPTA;3215;[15] KARAWANG;Kawasan Industri;Suryacipta IE;Kawasan Industri
1632;32;15;BEKAERT INDONESIA, PT;JL.SURYA UTAMA KAV I-14 SURYA CIPTA;3215;[15] KARAWANG;Kawasan Industri;Suryacipta IE;Kawasan Industri
1633;32;15;BERLIAN AMAL PERKASA;KAWASAN INDUSTRI KUJANG CIKAMPEK KAWASAN INDUSTRI II, KAVLING NO. 25-25B, JL. JENDRAL A. YANI NO. 39;3215;[15] KARAWANG;Kawasan Industri;Kujang Industrial Estate (KIE);Kawasan Industri
1634;32;15;BPS KABUPATEN KARAWANG;KARAWANG;;;;;Kawasan Industri
1635;32;15;EBARA TURBO MACHINERY SERVICES INDONESIA (ETSI);KAWASAN INDUSTRI SURYACIPTA;;;;;Kawasan Industri
1636;32;15;ESR INDONESIA PROPERTIES THREE;SURYA CIPTA CITY OF INDUSTRY, KUTANEGARA, KEC. CIAMPEL, KARAWANG, JAWA BARAT 41363;;;;;Kawasan Industri
1637;32;15;FREYABADI INDOTAMA, PT;KAWASAN INDUSTRI KIIC JL. MALIGI III LOT. J2-A;3215;[15] KARAWANG;Kawasan Industri;Karawang International Industrial City;Kawasan Industri
1638;32;15;FUJISEATINDONESIA,PT;JL. MALIGI VIII LOT S-6, KIIC;;;;;Kawasan Industri
1639;32;15;HELIJIA TECHNOLOGY INDONESIA (HANS JAYA);JL. SURYA MADYA XIV KAVLING I-67A5;;;;;Kawasan Industri
1640;32;15;HENGYI BUILDING MATERIALS INDONESIA,PT;KAWASAN INDUSTRI MITRA KARAWANG II BLOK D 22-23 JL. MITRA TIMUR II;;;;;Kawasan Industri
1641;32;15;MANDIRI SINERGI PLASTINDO PT;KAWASAN INDUSTRI MITRA KARAWANG, JL. MITRA TIMUR 2 BLOK D 18 - 20;3215;[15] KARAWANG;Kawasan Industri;Kawasan Industri Mitrakarawang;Kawasan Industri
1642;32;15;MOTHERSON YACHIYO TRIMITRA AUTOMOTIVE SYSTEMS INDONESIA, PT;KAWASAN INDUSTRI MITRAKARAWANG JL. MITRA SELATAN IV BLOK H3-6 KARAWANG 41363 JAWA BARAT;3215;[15] KARAWANG;Kawasan Industri;Kawasan Industri Mitrakarawang;Kawasan Industri
1643;32;15;PENGUIN INDONESIA (SURYA SARANA INTERNATIONAL);SURYA CIPTA CITY OF INDUSTRY, JLN SURYA MADYA KAV-1 NO 18A;;;;;Kawasan Industri
1644;32;15;PRIMA MANUNGGAL INTI INTERNUSA, PT;JL MITRA SELATAN III BLOK H-1;3215;[15] KARAWANG;Kawasan Industri;Kawasan Industri Mitrakarawang;Kawasan Industri
1645;32;15;PT. AKEBONO BRAKE ASTRA INDONESIA;JL. INDUSTRI RAYA DAN JALAN INDUSTRI II, LOT MM 26-27 KAWASAN INDUSTRI KIIC- KARAWANG TATABINA INDUSTRIAL ESTATE BLOK KRAMAT RONGGANG, MARGAMULYA, TELUK JAMBE BARAT, KARAWANG, JAWA BARAT 41361;;;;;Kawasan Industri
1646;32;15;PT. ALEXINDO ALUMINIUM EXTRUSION INDONESIA;JLN.DAWUAN GATE JAKARTA CIKAMPEK,TOL ROAD KM 68;;;;;Kawasan Industri
1647;32;15;PT. ARISU GRAPHIC PRIMA;JL. INDUSTRI RAYA III LOT MM-38;;;;;Kawasan Industri
1648;32;15;PT. BAIKSAN INDONESIA;JL TRANS HEKSA BLOK E NO 19-20 KAWASAN INDUSTRIAL ARTHA INDUSTRIAL HILL KARAWANG;;;;;Kawasan Industri
1649;32;15;BINTANG PUSPITA DWIKARYA, PT;JALAN TRANS HEKSA KARAWANG KM 3.00 DESA WANASARI TELUKJAMBE BARAT KARAWANG;;;;;Kawasan Industri
1650;32;15;PT. CAKRA WISESA UNGGUL PRATAMA (CWUP);BLOK E-11 PERTIWI LESTARI INDUSTRIAL ESTATE;;;;;Kawasan Industri
1651;32;15;PT. CATIB;KAWASAN ARTHA;;;;;Kawasan Industri
1652;32;15;PT. FRINA LESTARI INDONESIA;KAWASAN GREENLAND INTERNATIONAL INDUSTRIAL CENTER BLOK AF NO 1, NAGASARI, KEC. SERANG BARU, KABUPATEN BEKASI;;;;;Kawasan Industri
1653;32;15;PT. GT RADIAL;JL. TRANSHEKSA KJIE;;;;;Kawasan Industri
1654;32;15;PT. HINOMOTO INDONESIA;JL. HARAPAN IV LOT JJ-4, KAWASAN INDUSTRI KITA, DESA SIRNABAYA KEC. TELUKJAMBE TIMUR, KARAWANG;;;;;Kawasan Industri
1655;32;15;PT. INFITEK SOLUSI MANDIRI (ISM);KAWASAN PERTIWI LESTARI INDUSTRIAL ESTATE;;;;;Kawasan Industri
1656;32;15;PT. JAWATRANS INTERNUSA;KAWASAN INDUSTRI INDOTAISEI (KOTA BUKIT INDAH) SEKTOR 1A, BLOK E1-2, KALIHURIP, CIKAMPEK, KARAWANG, JAWA BARAT;3215;[15] KARAWANG;Kawasan Industri;Kawasan Industri Indotaisei (Kota Bukit Indah);Kawasan Industri
1657;32;15;PT. KARAWANG OUTLET MALL;JL TRANS HEKSA KM 2+506KARAWANG TAMAN NIAGA PRIMA WANASARI TELUK JAMBE BARAT KAB KARAWANG;;;;;Kawasan Industri
1658;32;15;PT. MABUCHI LOGISTICS INDONESIA;KAWASAN INDUSTRI KIIC, JL. MALIGI VI LOT Q-4A & B, SUKALUYU, KEC. TELUKJAMBE TIMUR, KAB. KARAWANG - JAWA BARAT;3215;[15] KARAWANG;Kawasan Industri;Karawang International Industrial City;Kawasan Industri
1659;32;15;PT. MITRA KARAWANG JAYA (#37);KAWASAN INDUSTRI MITRAKARAWANG, DESA PARUNGMULYA, KECAMATAN CIAMPEL, KABUPATEN KARAWANG, JAWA BARAT;;;;;Kawasan Industri
1660;32;15;PT. PERTIWI LESTARI (#136);PERTIWI LESTARI INDUSTRIAL ESTATE BLOK A 1 NO. 1 KABUPATEN KARAWANG JAWA BARAT;;;;;Kawasan Industri
1661;32;15;PT. SEINO INDOMOBIL LOGISTIC (SIL);POOL PT. SIL KARAWANG, MARGAMULYA, KEC. TELUKJAMBE BAR., KARAWANG, JAWA BARAT 41361;;;;;Kawasan Industri
1662;32;15;PT. SINAR ALUMSARANA;KAWASAN INDUSTRI KIIC, JL. HARAPAN VII, LOT. NO. LL-3C;3215;[15] KARAWANG;Kawasan Industri;Karawang International Industrial City;Kawasan Industri
1663;32;15;PT. SINGAPURA QFRESH SEJAHTERA (SQFS);KAWASAN PERTIWI LESTARI, JL. SUMATRA 1, SEKTOR B-II & C-I, DESA WANAJAYA, KEC. TELUK JAMBE BARAT, KAB. KARAWANG, DESA WANAJAYA, KEC. TELUKJAMBE BARAT, KAB. KARAWANG, PROVINSI JAWA BARAT 41361;;;;;Kawasan Industri
1664;32;15;PT. TAMFINDO MITRA MANDIRI;KAWASAN ARTHA INDUSTRI HILL KARAWANG BARAT KAV. E NO.12 DESA WANAJAYA KEL. WANAJAYA KEC. TELUKJAMBE BARAT KAB. KARAWANG PROV JAWA BARAT. KODE POS 41361;;;;;Kawasan Industri
1665;32;15;PT. TOPPAN PLASINDO LESTARI;JL MALIGI V LOT P1-P3, KAWASAN INDUSTRI KIIC, DESA MARGAKAYA KECAMATAN TELUK JAMBE BARAT KABUPATEN KARAWANG PROVINSI JAWA BARAT;3215;[15] KARAWANG;Kawasan Industri;Karawang International Industrial City;Kawasan Industri
1666;32;15;R&P TECHNOLOGIES INDONESIA ,PT;KAWASAN SURYA CIPTA KUTAMEKAR, KEC. CIAMPEL, KARAWANG, JAWA BARAT 41363;;;;;Kawasan Industri
1667;32;15;RAYARD DELI INDONESIA (SUMATERA HAKARINDO);KAWASAN INDUSTRI SURYA CIPTA BLOK KAV I-26A KEL KUTANEGARA KEC CIAMPEL;3215;[15] KARAWANG;Kawasan Industri;Suryacipta IE;Kawasan Industri
1668;32;15;RESONAC MATERIALS INDONESIA;JL.SURYA MADYA KAV.1-36A.KUTANEGARA.;;;;;Kawasan Industri
1669;32;15;KAWANO PILAR MANDIRI, PT;KAWASAN INDUSTRI FACTO BLOK F2-F3, CIKUPA, CIKUPA, KABUPATEN TANGERANG, BANTEN, 15710;;;;;Kawasan Industri
1670;32;15;WWRC INDONESIA;SURYA CIPTA OF .JL SURYA MADYA VIII BLOK C -65C4 MULYA SARI;;;;;Kawasan Industri
1671;32;15;YAMAGUCHI.PT;KAWASAN INDUSTRI KIIC;3215;[15] KARAWANG;Kawasan Industri;Karawang International Industrial City;Kawasan Industri
1672;32;15;DONGSUNG CHEMICAL INDONESIA;KAWASAN INDUSTRI KNIC BLOK B1;3215;[15] KARAWANG;Kawasan Industri;Karawang New Industrial City;Kawasan Industri
1673;32;15;WIJAYA KARYA KOMPONEN BETON (WIKA KOBE);KAWASAN INDUSTRI SURYACIPTA JL SURYA MADYA III KAV.I-28Q KUTANEGARA CIAMPEL;;;;;Kawasan Industri
1674;32;15;SANKEI DHARMA INDONESIA, PT;JL PERMATA RAYA LOT CA-3 KAWASAN INDUSTRI KIIC;3215;[15] KARAWANG;Kawasan Industri;Karawang International Industrial City;Kawasan Industri
1675;32;15;PAKOAKUINA II;JALAN SURYA PRATAMA KAVLING I-29 BLOK OPQR, KAWASAN INDUSTRI SURYACIPTA;3215;[15] KARAWANG;Kawasan Industri;Suryacipta IE;Kawasan Industri
1676;32;15;AKASHI WAHANA INDONESIA,PT;KAWASAN INDUSTRI SURYACIPTA, JL. SURYA MADYA VI, KAV. I-58 A-B;3215;[15] KARAWANG;Kawasan Industri;Suryacipta IE;Kawasan Industri
1677;32;15;PT. KAWASAN INDUSTRI KUJANG CIKAMPEK (#36);JL. JEND. A. YANI NO. 39 CIKAMPEK 41373;;;;;Kawasan Industri
1678;32;15;PT. MEIJI FOOD INDONESIA;JL MALIGI III LOT J - 2B KIIC;3215;[15] KARAWANG;Kawasan Industri;Karawang International Industrial City;Kawasan Industri
1679;32;15;PT. FIRMENICH AROMATICS INDONESIA;JL. MALIGI VIII LOT S-1, KAWASAN INDUSTRI KIIC;3215;[15] KARAWANG;Kawasan Industri;Karawang International Industrial City;Kawasan Industri
1680;32;15;ASTRA NIPPON GASKET INDONESIA, PT;JL MALIGI III LOT N-1 KIIC;3215;[15] KARAWANG;Kawasan Industri;Karawang International Industrial City;Kawasan Industri
1681;32;15;PT. HORIGUCHI ENGINEERING INDONESIA;JL. MALIGI RAYA, LOT D-1A, KARAWANG INDUSTRIAL INTERNATIONAL CITY, SUKALUYU, KARAWANG, WEST JAVA;;;;;Kawasan Industri
1682;32;15;PT. FUJITA INDONESIA;JL. MALIGI III LOT N3A KAWASAN INDUSTRI KIIC;3215;[15] KARAWANG;Kawasan Industri;Karawang International Industrial City;Kawasan Industri
1683;32;15;SHARP ELECTRONICS INDONESIA, PT;JL HARAPAN RAYA LOT LL 1 & 2;3215;[15] KARAWANG;Kawasan Industri;Karawang International Industrial City;Kawasan Industri
1684;32;15;TOYOTA MOTOR MANUFACTURING INDONESIA,;JL. PERMATA RAYA LOT D D-1/ KAWASAN IND. KIIC;3215;[15] KARAWANG;Kawasan Industri;Karawang International Industrial City;Kawasan Industri
1685;32;15;PT. PK MANUFACTURING INDONESIA;JL HARAPAN RAYA LOT JJ-2B KAWASAN INDUSTRI KIIC KARAWANG;3215;[15] KARAWANG;Kawasan Industri;Karawang International Industrial City;Kawasan Industri
1686;32;15;PT KASAI TECK SEE INDONESIA;JL MALIGI II LOT C8;3215;[15] KARAWANG;Kawasan Industri;Karawang International Industrial City;Kawasan Industri
1687;32;15;PT. PIOLAX INDONESIA;JL HARAPAN VII, LOT - 4B KAWASAN INDUSTRI KIIC;3215;[15] KARAWANG;Kawasan Industri;Karawang International Industrial City;Kawasan Industri
1688;32;15;SUNCHIRIN INDUSTRIES INDONESIA, PT;JL HARAPAN II LOT KK 5A;;;;;Kawasan Industri
1689;32;15;POSCO INDONESIA JAKARTA PROCESSING CENTER, PT;JL. PERMATA RAYA LOT FF 3, KAWASAN INDUSTRI KIIC, KARAWANG;3215;[15] KARAWANG;Kawasan Industri;Karawang International Industrial City;Kawasan Industri
1690;32;15;EXEDY MANUFACTURING INDONESIA,PT;JL. PERMATA V LOT EE 3 KAWASAN INDUSTRI KIIC;;;;;Kawasan Industri
1691;32;15;DIPSOL INDONESIA ,PT;KAWASAN SURYACIPTA;3215;[15] KARAWANG;Kawasan Industri;Suryacipta IE;Kawasan Industri
1692;32;15;DOWA THERMOTHEC INDONESIA, PT;KAWASAN INDUSTRI KIIC JL. MALIGI VI LOT 6-4,;;;;;Kawasan Industri
1693;32;15;SAKAE RIKEN INDONESIA, PT;SURYA CIPTA CITY OF INDUSTRY, JALAN SURYA KENCANA KAV. I-17GH, DESA KUTA MEKAR, KECAMATAN CIAMPEL, KUTAMEKAR, KEC. CIAMPEL, KARAWANG, JAWA BARAT 41361 1,5 KM;3215;[15] KARAWANG;Kawasan Industri;Suryacipta IE;Kawasan Industri
1694;32;15;PT. HAMATETSU INDONESIA;JL PERMATA RAYA LOT B-6A KAWASAN INDUSTRI KIIC;;;;;Kawasan Industri
1695;32;15;UYEMURA INDONESIA, PT;KAWASAN INDUSTRI SURYA CIPTA KAV I-2F;3215;[15] KARAWANG;Kawasan Industri;Suryacipta IE;Kawasan Industri
1696;32;15;SHINTO KOGYO INDONESIA, PT;JL. MALIGI I LOT A - 11 KIIC;;;;;Kawasan Industri
1697;32;15;CHUNPAO STEEL INDONESIA, PT;KAWASAN SURYA CIPTA KUTA MEKAR CIAMPEL;3215;[15] KARAWANG;Kawasan Industri;Suryacipta IE;Kawasan Industri
1698;32;15;PT. PRICOL SURYA;;;;;;Kawasan Industri
1699;32;15;DAIWABO NON MOVEN INDONESIA PT;KAWASAN INDUSTRI SURYA CIPTA, JL. SURYA LESTARI KAV 1;3215;[15] KARAWANG;Kawasan Industri;Suryacipta IE;Kawasan Industri
1700;32;15;PT. FUJI TECHNICA INDONESIA;KAWASAN INDUSTRI KIIC, JL. MALIGI RAYA LOT A6 & 7, SUKALUYU, TELUKJAMBE TIMUR, KARAWANG, JAWA BARAT 41361;3215;[15] KARAWANG;Kawasan Industri;Karawang International Industrial City;Kawasan Industri
1701;32;15;PT. IDEMITSU LUBE TECHNO INDONESIA;KARAWANG INTERNASIONAL INDUSTRIAL CITY;3215;[15] KARAWANG;Kawasan Industri;Karawang International Industrial City;Kawasan Industri
1702;32;15;PT. NBC INDONESIA;JL. MALIGI I LOT A9-10;3215;[15] KARAWANG;Kawasan Industri;Karawang International Industrial City;Kawasan Industri
1703;32;15;PT. MABUCHI INDONESIA;KAWASAN INDUSTRI KIIC, JL. MALIGI VI LOT Q 4 A & B;3215;[15] KARAWANG;Kawasan Industri;Karawang International Industrial City;Kawasan Industri
1704;32;15;MIYUKI INDONESIA PT;JL MALIGI VII LOT Q1B,KIIC KARAWANG;3215;[15] KARAWANG;Kawasan Industri;Karawang International Industrial City;Kawasan Industri
1705;32;15;MEIWA KOGYO INDONESIA,PT;JL. MALIGI IV LOT K -1D KAWASAN INDUSTRI KIIC;3215;[15] KARAWANG;Kawasan Industri;Karawang International Industrial City;Kawasan Industri
1706;32;15;PT. KARAWANG TATABINA INDUSTRIAL ESTATE;GRAHA KIIC LT.2 , JL.PERMATA RAYA LOT.C-1B KEL.SUKALUYU KEC.TELUKJAMBE KAB.KARAWANG - JAWA BARAT;;;;;Kawasan Industri
1707;32;15;PT. HARAPAN ANANG BAKRI & SONS (#176);JL. PERMATA RAYA LOT C-1B, KIIC, KARAWANG 41361;;;;;Kawasan Industri
1708;32;15;UNI-CHARM INDONESIA TBK, PT;KAWASAN INDUSTRI KIIC, JALAN MALIGI VI LOT 4-7, KAB. KARAWANG, JAWA BARAT;3215;[15] KARAWANG;Kawasan Industri;Karawang International Industrial City;Kawasan Industri
1709;32;15;SUMITOMO CONSTRUCTION MACHINERY;JL. MALIGI VIII LOT T-1 KAWASAN INDUSTRI KIIC;3215;[15] KARAWANG;Kawasan Industri;Karawang International Industrial City;Kawasan Industri
1710;32;15;DAIKI ALUMINIUM INUSTRY INDONESIA,PT;MALIGI VIII LOTT-2 KIIC;3215;[15] KARAWANG;Kawasan Industri;Karawang International Industrial City;Kawasan Industri
1711;32;15;PT. KOHWA PRECISION INDONESIA;KARAWANG;3215;[15] KARAWANG;Kawasan Industri;Karawang International Industrial City;Kawasan Industri
1712;32;15;KAWAMURA INDAH, PT;KAWASAN INDUSTRI KIIC LOT E - 4A,;3215;[15] KARAWANG;Kawasan Industri;Karawang International Industrial City;Kawasan Industri
1713;32;15;PT. MINDA ASEAN AUTOMOTIVE;JL PERMATA RAYA LOT CS 7 KIIC;;;;;Kawasan Industri
1714;32;15;OSIMO INDONESIA, PT;JL MALIGI RAYA LOT Q3 KIIC;;;;;Kawasan Industri
1715;32;15;SAITAMA STAMPING INDONESIA,PT;JL.PERMATA RAYA LOT.C 3A;3215;[15] KARAWANG;Kawasan Industri;Karawang International Industrial City;Kawasan Industri
1716;32;15;HOYU INDONESIA, PT;JL MALIGI IX LOT V2;3215;[15] KARAWANG;Kawasan Industri;Karawang International Industrial City;Kawasan Industri
1717;32;15;PT. WAHANA DUTA JAYA RUCIKA;KAWASAN INTERNASIONAL INDUSTRI CITY;3215;[15] KARAWANG;Kawasan Industri;Karawang International Industrial City;Kawasan Industri
1718;32;15;AICHIKIKI AUTOPARTS INDONESIA, PT;JL. MALIGI IV KAWASAN INDUSTRI KIIC LOT M/5;3215;[15] KARAWANG;Kawasan Industri;Karawang International Industrial City;Kawasan Industri
1719;32;15;MARUICHI INDONESIA, PT;JALAN MALIGI RAYA LOT Q2A;3215;[15] KARAWANG;Kawasan Industri;Karawang International Industrial City;Kawasan Industri
1720;32;15;TAIHO NUSANTARA,PT;JL. PERMATA RAYA LOT BB-8B, KAWSAN INDUSTRI KIIC;3215;[15] KARAWANG;Kawasan Industri;Karawang International Industrial City;Kawasan Industri
1721;32;15;FUJI SPRING INDONESIA, PT;JL. MALIGI VI LOT M-8B;3215;[15] KARAWANG;Kawasan Industri;Karawang International Industrial City;Kawasan Industri
1722;32;15;KALBE MORINAGA INDONESIA, PT;KAWASAN INDUSTRI INDOTAISEI SEKTOR 1 A BLOK Q1, KALIHURIP,;3215;[15] KARAWANG;Kawasan Industri;Kawasan Industri Indotaisei (Kota Bukit Indah);Kawasan Industri
1723;32;15;PT. HONDA PRECISION PARTS MANUFACTURING;KAWASAN INDUSTRI INDOTAISE;3215;[15] KARAWANG;Kawasan Industri;Kawasan Industri Indotaisei (Kota Bukit Indah);Kawasan Industri
1724;32;15;SUMI RUBBER INDONESIA PT;KAWASAN INDUSTRI INDOTAISAI KOTA BUKIT INDAH BLOK H SEKTOR;3215;[15] KARAWANG;Kawasan Industri;Kawasan Industri Indotaisei (Kota Bukit Indah);Kawasan Industri
1725;32;15;INDONESIA KOITO, PT;KAWASAN INDUSTRI INDOTAISE, SEKTOR IA, BLOK P-3, DESA/KELURAHAN KALIHURIP, KECAMATAN CIKAMPEK, KAN. KARAWANG, PROV JAWA BARAT, KODEPOS :42373, INDONESIA;3215;[15] KARAWANG;Kawasan Industri;Kawasan Industri Indotaisei (Kota Bukit Indah);Kawasan Industri
1726;32;15;ASAHI MAS FLAT GLASS PT;KAWASAN INDUSTRI INDOTAISEI;;;;;Kawasan Industri
1727;32;15;PT. INDOTAISEI INDAH DEVELOPMENT (#35);KAWASAN INDUSTRI INDOTAISEI SEKTOR IA BLOK B, KOTA BUKIT INDAH, KALIHURIP-CIKAMPEK, KARAWANG - JAWA BARAT;;;;;Kawasan Industri
1728;32;15;MC NS POLYURETHANES INDONESIA, PT;KAWASAN INDUSTRI INDOTAISEI BLOK F / 1A;;;;;Kawasan Industri
1729;32;15;KOYAMA CASTING INDONESIA, PT;KAWASAN INDUSTRI INDOTAISEI SEKTOR IA BLOK K-8 KOTA BUKIT INDAH;3215;[15] KARAWANG;Kawasan Industri;Kawasan Industri Indotaisei (Kota Bukit Indah);Kawasan Industri
1730;32;15;STARCH SOLUTION INTERNASIONAL, PT;KAWASAN INDUSTRI INDOTAISE KAV.F-3 SEKTOR IA CIKAMPEK,KARAWANG;;;;;Kawasan Industri
1731;32;15;NAKAGAWA SANGYO INDONESIA PT;KAWASAN INDOTAISEI SEKTOR IA BLOK KK 11-12;3215;[15] KARAWANG;Kawasan Industri;Kawasan Industri Indotaisei (Kota Bukit Indah);Kawasan Industri
1732;32;15;PT. PRETEC INDONESIA;KAWASAN INDUSTRI INDOTAISEI SEKTOR IA BLOK K 10 KEL. KALIHURIP KEC. CIKAMPEK KAB. KARAWANG 41373;;;;;Kawasan Industri
1733;32;15;CLARIANT KUJANG CATALYSTS PT;JL. A. YANI NO. 39 KAWASAN INDUSTRI KUJANG;3215;[15] KARAWANG;Kawasan Industri;Kujang Industrial Estate (KIE);Kawasan Industri
1734;32;15;MEGAYAKU KENASAN PERDANA. PT;KAWASAN INDUSTRI KUJANG CIKAMPEK;;;;;Kawasan Industri
1735;32;15;PT ASAMA INDONESIA MANUFACTURING;KAWASAN INDUSTRI MITRAKARAWANG, JL. MITRA SELATAN II, DESA PARUNGMULYA, KECAMATAN CIAMPEL, KABUPATEN KARAWANG, JAWA BARAT 41363;;;;;Kawasan Industri
1736;32;15;PT SANGO INDONESIA;KAWASAN INDUSTRI MITRAKARAWANG MITRA SELATAN IV BLOK M1-2, DESA PARUNGMULYA,KACAMATAN CIAMPEL, KARAWANG 41361 JAWA BARAT - INDONESIA.;3215;[15] KARAWANG;Kawasan Industri;Kawasan Industri Mitrakarawang;Kawasan Industri
1737;32;15;CENTURY BATTERIES INDONESIA, PT;JL. MITRA RAYA SELATAN I BLOKE 17-18 KIM;3215;[15] KARAWANG;Kawasan Industri;Kawasan Industri Mitrakarawang;Kawasan Industri
1738;32;15;TOKAI RUBBER INDONESIA, PT;KAWASAN INDUSTRI MITRA KARAWANG, JLN. MITRA TIMUR II BLOK E NO.13-14;3215;[15] KARAWANG;Kawasan Industri;Kawasan Industri Mitrakarawang;Kawasan Industri
1739;32;15;EHWA INDONESIA, PT;KAWASAN INDUSTRI MITRAKARAWANG JL. MITRA TIMUR II BLOK D NO 8-9;;;;;Kawasan Industri
1740;32;15;PT. BYC INDONESIA;KAWASAN INDUSTRI MITRA KARAWANG;;;;;Kawasan Industri
1741;32;15;STEEL PIPE INDUSTRY OF INDONESIA, PT;KAWASAN MITRA KARAWANG JL. MITRA RAYA II NO.F2, PARUNGMULYA, KEC. CIAMPEL, KARAWANG, JAWA BARAT 41363·39 M;3215;[15] KARAWANG;Kawasan Industri;Kawasan Industri Mitrakarawang;Kawasan Industri
1742;32;15;HEXING TECHNOLOGY, PT;JL. MITRA TIMUR II BLOK D-24 KAWASAN INDUSTRI MITRA;3215;[15] KARAWANG;Kawasan Industri;Kawasan Industri Mitrakarawang;Kawasan Industri
1743;32;15;PT. NICHIRIN INDONESIA;JL. MITRA TIMUR I BLOK C6 PARUNGMULYA KEC. CIAMPE KARAWANG JAWA BARAT 41363;3215;[15] KARAWANG;Kawasan Industri;Kawasan Industri Mitrakarawang;Kawasan Industri
1744;32;15;AUTOMOTIVE FASTENERS AOYAMA INDONESIA, PT;KAWASAN INDUSTRI MITRAKARAWANG JL. MITRA SELATAN IV BLOK M3-M4;3215;[15] KARAWANG;Kawasan Industri;Kawasan Industri Mitrakarawang;Kawasan Industri
1745;32;15;PT MITRAMETAL PERKASA;KAWASAN INDUSTRI MITRA;3215;[15] KARAWANG;Kawasan Industri;Kawasan Industri Mitrakarawang;Kawasan Industri
